PROVIDER_ID,PROVIDER_NAME,STATE,BASELINE_READMISSION_RATE,PERFORMANCE_READMISSION_RATE
505303,REGENCY OMAK,WA,0.1948,0.20102
105346,LAKE MONTGOMERY HEALTH AND REHABILITATION CENTER,FL,0.22393,0.20102
675030,REGENT CARE CENTER OF LAREDO,TX,0.18448,0.20103
555098,GREENHAVEN HEALTHCARE CENTER,CA,0.18981,0.20104
105429,FIRST COAST HEALTH AND REHABILITATION CENTER,FL,0.18008,0.20104
366023,TWIN TOWERS,OH,0.20584,0.20105
415039,HERITAGE HILLS NURSING & REHABILITATION CENTER,RI,0.21031,0.20105
505383,SULLIVAN PARK CARE CENTER,WA,0.21183,0.20105
215111,LAURELWOOD HEALTHCARE CENTER,MD,0.19039,0.20106
105488,RIVERWOOD HEALTHCARE & REHABILITATION CENTER,FL,0.22755,0.20108
146017,ILLINI HERITAGE REHAB & HC,IL,,0.20108
265655,GOLDEN AGE LIVING CENTER,MO,0.20668,0.20108
335030,MOSHOLU PARKWAY NURSING & REHABILITATION CENTER,NY,,0.20109
365671,WORTHINGTON CHRISTIAN VILLAGE,OH,0.17565,0.20109
165156,FORT DODGE HEALTH AND REHABILITATION,IA,0.2154,0.20109
425396,PRESBYTERIAN HOME OF SOUTH CAROLINA-COLUMBIA,SC,0.18318,0.20109
155684,SOUTHFIELD VILLAGE,IN,0.21018,0.2011
305068,THE ELMS CENTER,NH,0.21385,0.2011
235485,GLADWIN PINES NURSING AND REHABILITATION CENTER,MI,0.20948,0.20111
055147,MADERA REHABILITATION & NURSING CENTER,CA,0.18004,0.20112
445463,BELLS NURSING AND REHABILITATION CENTER,TN,0.20534,0.20113
555125,LINWOOD MEADOWS CARE CENTER,CA,0.1947,0.20114
676243,REMINGTON TRANSITIONAL CARE OF RICHARDSON,TX,0.21519,0.20114
525304,NORTH SHORE HEALTHCARE AT MARSHFIELD,WI,0.19897,0.20114
445458,FOUR OAKS HEALTH CARE CENTER,TN,0.20556,0.20114
195636,THE GARDENS AND GUARDIAN,LA,0.22686,0.20115
555141,TOWN & COUNTRY,CA,0.19719,0.20115
335840,MEDFORD MULTICARE CENTER FOR LIVING,NY,0.19408,0.20115
366410,ST CLARE COMMONS,OH,0.19226,0.20115
185165,LYNDON CROSSING,KY,0.20445,0.20115
675852,ADVANCED REHABILITATION AND HEALTHCARE OF WICHITA,TX,0.2008,0.20115
055084,RIVERBANK POST-ACUTE,CA,0.18741,0.20116
555831,HERMAN HEALTH CARE CENTER,CA,0.20148,0.20117
425287,MIDLANDS HEALTH & REHABILITATION CENTER,SC,0.21512,0.20117
366465,GLEN THE,OH,0.2251,0.20117
345342,BIG ELM RETIREMENT AND NURSING CENTERS,NC,0.16042,0.20117
155462,SWISS VILLA NURSING AND REHABILITATION,IN,0.20026,0.20118
335734,"FRIEDWALD CENTER FOR REHAB AND NURSING, L L C",NY,0.21043,0.20118
146165,"ADMIRAL AT THE LAKE, THE",IL,0.21507,0.20119
105193,PARK MEADOWS HEALTHCARE & REHABILITATION CENTER,FL,0.19577,0.20119
155230,ROSEBUD VILLAGE,IN,0.20691,0.2012
345243,ACCORDIUS HEALTH AT CHARLOTTE,NC,0.18729,0.20121
275103,CONTINENTAL CARE AND REHABILITATION,MT,0.19022,0.20121
445469,IVY HALL NURSING HOME,TN,0.17635,0.20122
235075,COREWELL HTLH GR HOSPS REHAB & NSG CTR-1226CEDARST,MI,0.19439,0.20122
145465,JERSEYVILLE NSG & REHAB CENTER,IL,0.20275,0.20123
555707,IMPERIAL CARE CENTER,CA,0.19716,0.20123
065267,WINDING TRAILS POST ACUTE,CO,0.19932,0.20123
135019,"ORCHARDS OF CASCADIA, THE",ID,0.17275,0.20124
105155,SARASOTA HEALTH AND REHABILITATION CENTER,FL,0.20851,0.20124
445237,CHURCH HILL POST-ACUTE AND REHABILITATION CENTER,TN,0.21613,0.20125
155381,HARBOUR MANOR HEALTH & LIVING COMMUNITY,IN,0.19985,0.20126
505275,"COLVILLE OF CASCADIA, LLC",WA,0.1816,0.20126
675142,BRIARCLIFF HEALTH CENTER,TX,0.21503,0.20126
745000,LAS ALTURAS DE PENITAS,TX,,0.20127
075411,MATULAITIS NURSING HOME,CT,0.18647,0.20127
395078,PINE VIEW HEALTHCARE AND REHABILITATION CENTER,PA,0.19728,0.20127
366068,ORCHARD VILLA,OH,0.23096,0.20127
495365,MAPLE GROVE NURSING & REHAB CENTER,VA,0.19269,0.20128
395666,SPRING HILL REHABILITATION AND NURSING CENTER,PA,,0.20129
676327,THE SPRINGS HEALTHCARE AND REHABILITATION,TX,0.18994,0.2013
415087,GREENVILLE SKILLED NURSING AND REHABILITATION,RI,0.19511,0.2013
055888,HUNTINGTON VALLEY HEALTHCARE CENTER,CA,0.21421,0.2013
345205,WESTWOOD HILLS NURSING AND REHABILITATION CENTER,NC,0.18374,0.20131
055473,NEW VISTA POST-ACUTE CARE CENTER,CA,,0.20131
075240,COMPLETE CARE AT GLENDALE,CT,0.2315,0.20132
555093,ST EDNA SUBACUTE AND REHABILITATION CENTER,CA,0.17392,0.20133
555733,THE PAVILION AT SUNNY HILLS,CA,0.17819,0.20133
265705,GOOD SHEPHERD COMMUNITY CARE AND REHABILITATION,MO,0.20895,0.20134
115684,SENIOR CARE CENTER - ST MARYS,GA,0.21237,0.20135
425085,PRUITTHEALTH- ORANGEBURG,SC,0.20137,0.20135
335164,HUMBOLDT HOUSE REHABILITATION AND NURSING CENTER,NY,0.18803,0.20136
145275,TIMBERCREEK REHAB & HEALTHCARE CENTER,IL,0.21344,0.20136
555350,MADISON GROVE POST ACUTE,CA,0.17778,0.20136
265447,MCDONALD COUNTY LIVING CENTER,MO,0.17694,0.20136
215199,AUTUMN LAKE HEALTHCARE AT BRADDOCK HEIGHTS,MD,0.18609,0.20137
185149,LANDMARK OF BARDSTOWN REHABILITATION AND NURSING,KY,0.19392,0.20138
146103,HENDERSON COUNTY RET CENTER,IL,0.20992,0.20138
155271,"WATERS OF CASTLETON SKILLED NURSING FACILITY, THE",IN,0.17091,0.20139
105478,ADVANCED CARE CENTER,FL,0.20444,0.20139
146057,MONMOUTH NURSING HOME,IL,,0.20139
265400,BROOKE HAVEN HEALTHCARE,MO,0.19965,0.2014
155770,"WATERS OF GEORGETOWN, THE",IN,0.21345,0.2014
175544,"IGNITE MEDICAL RESORT RAINBOW BOULEVARD, LLC",KS,0.23583,0.20141
165470,PLEASANTVIEW HOME,IA,,0.20142
105439,NAPLES HEALTH AND REHABILITATION CENTER,FL,0.21843,0.20142
155632,LODGE OF THE WABASH,IN,,0.20144
245200,BIRCHWOOD HEALTH CARE CENTER,MN,0.20249,0.20144
285106,EMERALD NURSING & REHAB LAKEVIEW,NE,0.19044,0.20144
155076,BRICKYARD HEALTHCARE - BROOKVIEW CARE CENTER,IN,0.19194,0.20144
366372,KEYSTONE POINTE HEALTH AND REHABILITATION,OH,0.19278,0.20146
055991,MISSION PARK HEALTHCARE CENTER,CA,0.15085,0.20146
365927,REGINA HEALTH CENTER,OH,0.17446,0.20146
676482,CYPRESS POINTE HEALTH & WELLNESS,TX,,0.20147
395413,WESLEY ENHANCED LIVING PENNYPACK PARK,PA,0.18748,0.20147
675862,PARK BEND HEALTH CENTER,TX,0.19259,0.20149
335753,BRONXCARE SPECIAL CARE CENTER,NY,0.1903,0.20149
335748,SAINTS JOACHIM & ANNE NURSING AND REHAB CENTER,NY,0.23205,0.20149
455573,TEXOMA HEALTHCARE CENTER,TX,0.17947,0.2015
345123,CAROLINA VILLAGE INC,NC,0.19349,0.20151
155215,PLAINFIELD HEALTH CARE CENTER,IN,0.20325,0.20152
105658,SOLARIS HEALTHCARE LAKE ZEPHYR,FL,0.20212,0.20152
105505,MARGATE HEALTH AND REHABILITATION CENTER,FL,0.22204,0.20152
075374,MONSIGNOR BOJNOWSKI MANOR,CT,0.20836,0.20152
045289,"LONOKE HEALTH AND REHAB CENTER, LLC",AR,0.20331,0.20153
366272,O'NEILL HEALTHCARE NORTH OLMSTED,OH,0.20779,0.20153
146046,MARSHALL REHAB & NURSING,IL,0.25092,0.20153
056359,SAN PABLO HEALTHCARE & WELLNESS CENTER,CA,0.16604,0.20154
315494,ALARIS HEALTH AT THE CHATEAU,NJ,0.20243,0.20154
015210,"OPP HEALTH AND REHABILITATION, LLC",AL,0.18443,0.20154
175258,MEDICALODGES FORT SCOTT,KS,0.19533,0.20155
075350,SHERIDEN WOODS HEALTH CARE CENTER,CT,0.20362,0.20155
115682,BUDD TERRACE AT WESLEY WOODS,GA,0.17243,0.20155
335531,HILLSIDE MANOR REHAB & EXTENDED CARE CENTER,NY,0.18352,0.20156
045428,EDGEWOOD HEALTH AND REHAB,AR,0.18105,0.20156
165273,VIA OF DES MOINES,IA,0.20718,0.20157
235103,SKLD BELTLINE,MI,0.20548,0.20158
455923,BIRCHWOOD OF BEEVILLE,TX,0.17436,0.20158
245486,PERHAM LIVING,MN,0.19458,0.20159
225773,LINDEN PONDS,MA,0.18174,0.2016
015448,SOUTH HAMPTON NURSING & REHABILITATION CENTER,AL,0.21088,0.2016
676008,SILSBEE OAKS HEALTH CARE LLP,TX,0.20175,0.20161
105879,WESTMINSTER WINTER PARK,FL,0.21854,0.20161
235349,MISSION POINT NSG & PHY REHAB CTR OF ISHPEMING,MI,0.21215,0.20162
235290,MISSION POINT NSG & PHY REHAB CTR OF GREENVILLE,MI,0.20582,0.20163
525635,MILWAUKEE CATHOLIC HOME,WI,0.19174,0.20164
015186,"GLEN HAVEN HEALTH AND REHABILITATION, LLC",AL,0.18094,0.20164
145494,MCLEAN COUNTY NURSING HOME,IL,0.22342,0.20164
165604,KEYSTONE NURSING CARE CENTER INC,IA,0.18284,0.20165
075389,APPLE REHAB LAUREL WOODS,CT,0.23006,0.20165
215308,OAK CREST VILLAGE,MD,0.21057,0.20165
125019,THE CARE CENTER OF HONOLULU,HI,0.15929,0.20165
115565,ROSEMONT AT STONE MOUNTAIN,GA,0.19008,0.20165
675746,CORONADO NURSING CENTER,TX,0.20138,0.20166
205063,CLOVER HEALTH CARE,ME,0.19841,0.20166
055329,VILLA SERENA HEALTHCARE CENTER,CA,0.16672,0.20166
265071,MASON POINTE CARE CENTER,MO,0.21619,0.20166
105440,ASPIRE AT COLONIAL LAKES,FL,0.18978,0.20167
335077,NORTHWOODS REHAB AND NURSING CENTER AT MORAVIA,NY,,0.20167
195498,CHATEAU NAPOLEON CARING,LA,0.23538,0.20167
375141,RIVER VALLEY SKILLED NURSING AND THERAPY,OK,0.17732,0.20167
365085,LIFE CARE CENTER OF MEDINA,OH,0.1936,0.20168
155094,ST MARY HEALTHCARE CENTER,IN,0.19887,0.20168
225439,ODD FELLOWS HOME OF MASSACHUSETTS,MA,,0.20169
015336,"LUVERNE HEALTH AND REHABILITATION, LLC",AL,0.19462,0.2017
056200,COMMUNITY MEMORIAL CONTINUING CARE CENTER,CA,,0.2017
015420,CUMBERLAND HEALTH AND REHAB,AL,0.1969,0.20171
245215,ECUMEN LAKESHORE,MN,0.19826,0.20171
366273,ASTORIA PLACE OF CAMBRIDGE,OH,0.2429,0.20173
345314,"FAIR HAVEN OF FOREST CITY, LLC",NC,0.2139,0.20173
245250,TRINITY CARE CENTER,MN,0.17861,0.20174
056153,NAPA POST ACUTE,CA,0.19441,0.20174
115636,FOUNTAIN BLUE REHAB AND NURSING,GA,0.20722,0.20174
155705,HERITAGE POINTE OF WARREN,IN,0.18954,0.20175
115401,PRUITTHEALTH - SPRING VALLEY,GA,0.18392,0.20175
165545,WINDMILL MANOR,IA,0.19396,0.20176
065256,HIGHLINE POST ACUTE,CO,0.17825,0.20177
325037,LADERA CENTER,NM,0.17835,0.20177
365453,AYDEN HEALTHCARE OF OREGON,OH,0.20222,0.20179
255141,PICAYUNE REHABILITATION AND HEALTHCARE CENTER,MS,0.20755,0.20181
115541,CROSSVIEW CARE CENTER,GA,,0.20181
055304,BROOKSIDE CARE CENTER,CA,0.18647,0.20181
155019,MAJESTIC CARE OF BLOOMINGTON,IN,0.18664,0.20182
055481,VIENNA NURSING AND REHABILITATION CENTER,CA,0.20267,0.20183
366250,KIMES NURSING & REHAB CTR,OH,0.214,0.20184
495258,AUTUMN CARE OF SUFFOLK,VA,0.16944,0.20185
235182,LYNWOOD MANOR HEALTHCARE CENTER,MI,0.18615,0.20185
165179,NORWALK NURSING AND REHABILITATION CENTER,IA,0.19657,0.20186
366144,MENNONITE MEMORIAL HOME,OH,0.21258,0.20186
445126,"NHC HEALTHCARE, SEQUATCHIE",TN,0.17941,0.20186
146117,CASEY HEALTHCARE CENTER,IL,0.18613,0.20187
065370,LIFE CARE CENTER OF LITTLETON,CO,0.1686,0.20187
185136,WESLEY MANOR,KY,0.21602,0.20188
366320,SHAWNEESPRING HEALTH CARE CENTER,OH,0.16481,0.20188
335248,FIELDSTON LODGE CARE CENTER,NY,0.18668,0.20189
525468,ST CROIX HEALTH CENTER,WI,0.18954,0.2019
475021,SAINT ALBANS HEALTHCARE AND REHABILITATION CENTER,VT,0.21157,0.20191
335361,CLIFTON SPRINGS HOSPITAL AND CLINIC EXTENDED CARE,NY,0.19139,0.20191
055649,"TULARE HEALTHCARE & WELLNESS CENTER, LP",CA,0.21608,0.20192
445171,"THE WATERS OF SHELBYVILLE, LLC",TN,0.19272,0.20193
145730,CONTINENTAL NURSING & REHAB CENTER,IL,0.19622,0.20193
145198,BELLA TERRA MORTON GROVE,IL,0.19941,0.20193
676462,ST. ANTHONY'S CARE CENTER,TX,0.17941,0.20194
215025,COMPLETE CARE AT WHEATON,MD,0.18759,0.20195
056084,ASTORIA NURSING AND REHAB CENTER,CA,0.19782,0.20195
145654,LAKEVIEW  REHAB & NURSING CENTER,IL,0.18185,0.20196
366393,OTTERBEIN AT MAINEVILLE,OH,0.22689,0.20198
055142,MAGNOLIA GARDENS CONVALESCENT HOSPITAL,CA,0.2024,0.20198
106028,ASPIRE AT SHOAL CREEK,FL,0.19584,0.20199
235139,AVISTA NURSING AND REHAB,MI,0.1991,0.202
265385,HERITAGE HALL NURSING CENTER,MO,0.22532,0.202
115724,CHELSEY PARK HEALTH AND REHABILITATION,GA,0.20342,0.202
366432,SANCTUARY POINTE NURSING & REHABILITATION CENTER,OH,0.19073,0.20201
065354,COLOROW HEALTH CARE LLC,CO,0.17433,0.20201
675386,WHISPERING PINES LODGE,TX,0.18346,0.20201
145877,APERION CARE DOLTON,IL,0.21923,0.20202
375518,THE HEALTH CENTER AT CONCORDIA,OK,0.23516,0.20202
105333,"AVANTE AT MT DORA, INC",FL,0.1888,0.20203
265825,ELSBERRY MISSOURI HEALTH CARE CENTER,MO,,0.20203
345462,THE OAKS-BREVARD,NC,0.16773,0.20203
555746,BAYSHIRE TORREY PINES POST-ACUTE,CA,0.2028,0.20203
105365,LIFE CARE CENTER OF ALTAMONTE SPRINGS,FL,0.1826,0.20203
245324,THE ESTATES AT BLOOMINGTON LLC,MN,0.18701,0.20204
525335,SHAWANO HEALTH SERVICES,WI,0.17383,0.20205
676207,THE COLONNADES AT REFLECTION BAY,TX,0.19729,0.20206
195598,OAK WOODS HOME FOR THE ELDERLY,LA,0.16852,0.20206
245267,ST ANTHONY HEALTH & REHABILITATION,MN,0.16001,0.20206
055488,LA MESA HEALTHCARE CENTER,CA,0.18697,0.20206
676372,TWIN PINES NORTH NURSING AND REHABILITATION CENTER,TX,0.18156,0.20207
056231,LASSEN NURSING & REHABILITATION CENTER,CA,,0.20209
365192,GREENBRIER HEALTH CENTER,OH,0.18167,0.2021
045436,"PRESBYTERIAN VILLAGE, INC",AR,0.21205,0.2021
445272,"WATERS OF GAINESBORO, LLC",TN,0.23009,0.20211
335721,HERITAGE GREEN REHAB & SKILLED NURSING,NY,0.1715,0.20213
056026,"EMPRESS CARE CENTER, LLC",CA,0.19047,0.20213
375107,THE GRAND AT BETHANY SKILLED NURSING AND THERAPY,OK,0.18666,0.20213
155851,ORCHARD POINTE HEALTH CAMPUS,IN,0.2438,0.20214
065077,ENGLEWOOD POST ACUTE AND REHABILITATION,CO,0.21382,0.20214
035272,"VI AT GRAYHAWK, A VI AND PLAZA COMPANIES COMMUNITY",AZ,0.17539,0.20216
455785,WESTERN HILLS NURSING & REHABILITATION,TX,0.18926,0.20216
395753,BEAUMONT AT BRYN MAWR,PA,0.19814,0.20216
675478,PRAIRIE HOUSE LIVING CENTER,TX,0.19812,0.20216
165577,GREEN HILLS HEALTH CARE CENTER,IA,0.19847,0.20216
225134,FOREMOST AT SHARON LLC,MA,0.19376,0.20218
555729,ARCADIA CARE CENTER,CA,0.17595,0.20218
265546,GASCONADE MANOR NURSING HOME,MO,0.20484,0.20218
235284,MEDILODGE OF MIDLAND,MI,0.20443,0.20219
235155,MARTHA T BERRY MCF,MI,0.21339,0.2022
055809,ST ANTHONY CARE CENTER,CA,0.17074,0.20221
145778,MIDWAY NEUROLOGICAL / REHAB CENTER,IL,0.20769,0.20221
475027,BENNINGTON HEALTH & REHAB,VT,0.20446,0.20221
365393,AYDEN HEALTHCARE OF JACKSON,OH,0.21163,0.20222
146098,SHARON HEALTH CARE ELMS,IL,0.22378,0.20222
335711,SLATE VALLEY CENTER FOR REHABILITATION AND NURSING,NY,0.19298,0.20222
676350,THE HEIGHTS OF TOMBALL,TX,0.20262,0.20222
335440,THE PINES AT POUGHKEEPSIE CTR FOR NURSING & REHAB,NY,0.1982,0.20222
425314,PIEDMONT POST-ACUTE,SC,0.20315,0.20222
045176,"THE WOODS, A NIGHTINGALE COMMUNITY",AR,0.20195,0.20225
055984,"ANAHEIM HEALTHCARE CENTER, LLC",CA,0.16955,0.20225
155697,CLARK REHABILITATION AND SKILLED NURSING CENTER,IN,0.19265,0.20225
115543,MAPLE RIDGE HEALTH CARE CENTER,GA,0.17234,0.20225
146172,SPRING CREEK,IL,0.2047,0.20226
155702,APERION CARE PERU,IN,0.17125,0.20227
395782,FAIRVIEW NURSING AND REHABILITATION CENTER,PA,0.20831,0.20228
056195,LA BREA REHABILITATION CENTER,CA,0.19397,0.20228
255305,RIVER PLACE NURSING CENTER,MS,0.20622,0.20228
045442,CAVALIER HEALTHCARE OF ENGLAND,AR,0.20483,0.2023
395545,ACCELA REHAB AND CARE CENTER AT SPRINGFIELD,PA,0.19082,0.20231
675305,PLEASANT VALLEY HEALTHCARE AND REHABILITATION CENT,TX,0.18734,0.20232
366358,OTTERBEIN NORTH SHORE,OH,0.16706,0.20232
325036,LAS PALOMAS CENTER,NM,0.21331,0.20232
175253,ROLLING HILLS HEALTH AND REHAB,KS,0.19864,0.20232
395290,PLEASANT ACRES REHABILITATION AND NURSING CENTER,PA,0.17934,0.20233
365489,EDGEWOOD MANOR REHABILITATION  & HEALTHCARE CENTER,OH,0.20776,0.20233
395104,SAINT MARY'S VILLA NURSING HOM,PA,0.17999,0.20233
365968,ADMIRAL'S POINTE NURSING & REHABILITATION,OH,0.22085,0.20233
195620,POINTE COUPEE HEALTHCARE,LA,0.19502,0.20234
676249,THE CARLYLE AT STONEBRIDGE PARK,TX,0.16939,0.20235
146093,MEADOWBROOK MANOR - LAGRANGE,IL,0.2002,0.20236
335136,LORETTO HEALTH AND REHABILITATION CENTER,NY,0.19659,0.20236
395879,QUALITY LIFE SERVICES - MERCER,PA,0.21486,0.20236
105323,"OAKS OF CLEARWATER, THE",FL,0.21633,0.20237
035240,HAVEN OF LAKE HAVASU,AZ,0.21442,0.20237
345163,GLENBRIDGE HEALTH AND REHABILTATION,NC,0.16248,0.20237
105780,OAKS AT AVON,FL,0.21397,0.20237
385180,MARQUIS NEWBERG,OR,0.18004,0.20237
315192,ALARIS HEALTH AT KEARNY,NJ,0.21111,0.20238
395588,EMBASSY OF PARK AVENUE,PA,0.18431,0.20238
225679,ROYAL MEGANSETT NURSING & REHABILITATION,MA,0.17735,0.20238
395449,CHAPEL MANOR,PA,0.17341,0.2024
015382,CANTERBURY HEALTH CARE FACILITY,AL,0.1835,0.2024
355079,SMP HEALTH - ST CATHERINE SOUTH,ND,0.18753,0.20241
155736,MILL POND HEALTH CAMPUS,IN,0.19708,0.20241
185339,IRVINE NURSING AND REHABILITATION CENTER,KY,0.18664,0.20242
445512,NASHVILLE CENTER FOR REHABILITATION AND HEALING LL,TN,0.20409,0.20243
055311,KATHERINE HEALTHCARE,CA,0.17335,0.20244
395609,ROUSE WARREN COUNTY HOME,PA,0.21831,0.20245
676459,SEDONA TRACE HEALTH AND WELLNESS CENTER,TX,0.16239,0.20245
225176,AGAWAM SOUTH REHAB AND NURSING,MA,0.22838,0.20245
215026,POTOMAC VALLEY REHABILITATION AND HEALTHCARE,MD,0.20375,0.20246
155827,SAGE BLUFF HEALTH & REHAB CENTER,IN,0.22054,0.20246
415029,GOLDEN CREST NURSING CENTRE,RI,0.21175,0.20247
366476,VILLAGE OF THE FALLS,OH,,0.20247
235036,THE SPRINGS AT ROCHESTER HILLS REHAB & NURSING CTR,MI,0.19741,0.20247
115625,WYNFIELD PARK HEALTH AND REHABILITATION,GA,0.20696,0.20247
525704,EDEN REHAB SUITES AND GREEN HOUSE HOMES,WI,0.19917,0.20247
055376,HUNTINGTON DRIVE HEALTH AND REHABILITATION CENTER,CA,0.20798,0.20248
555246,VISTA VIEW POST ACUTE,CA,0.20144,0.20248
325045,PRINCETON HEALTH & REHABILITATION,NM,0.1842,0.20248
555767,BELLAKEN SKILLED NURSING CENTER,CA,0.20365,0.20248
395490,WILLOWBROOKE COURT-SOUTHAMPTON,PA,0.23209,0.20248
065431,"CENTER AT CENTERPLACE, LLC, THE",CO,,0.20249
106003,LADY LAKE SPECIALTY CARE CENTER AND REHAB,FL,0.17557,0.20249
395926,ST LUKE'S HOSPITAL SACRED HEART CAMPUS TCF,PA,0.19539,0.2025
675111,HERITAGE GARDENS REHABILITATION AND HEALTHCARE,TX,0.19131,0.2025
365588,ARCADIA VALLEY SKILLED NURSING AND REHABILITATION,OH,0.18217,0.2025
235294,MISSION POINT NSG & PHY REHAB CTR OF CEDAR SPRINGS,MI,0.20007,0.2025
255221,HAVEN HALL HEALTH CARE CENTER,MS,0.19623,0.20251
366087,"VISTA CENTER, THE",OH,0.17405,0.20252
245071,MOUNT OLIVET CAREVIEW HOME,MN,0.2083,0.20252
155095,HERITAGE PARK,IN,0.18362,0.20253
525608,RIDGEWOOD CARE CTR,WI,0.22527,0.20253
145027,ALLURE OF THE QUAD CITIES,IL,0.25549,0.20253
145200,FRANKLIN GROVE LIVING AND REHAB,IL,0.17427,0.20254
185244,STANFORD CROSSING,KY,0.18812,0.20255
155745,HOLY CROSS VILLAGE AT NOTRE DAME INC,IN,0.21042,0.20255
155109,BRICKYARD HEALTHCARE - TWELFTH STREET CARE CENTER,IN,0.18388,0.20255
215337,FAHRNEY-KEEDY MEMORIAL HOME,MD,0.16503,0.20255
675238,TRINITY TERRACE,TX,0.18362,0.20256
345433,CLAY COUNTY CARE CENTER,NC,0.17492,0.20256
555660,ZUCKERBERG SAN FRANCISCO GENERAL HOSP & TRAUMA SNF,CA,0.19705,0.20257
285219,SOUTHLAKE VILLAGE REHABILITATION & CARE CENTER,NE,0.19296,0.20258
165316,ELDORA SPECIALTY CARE,IA,,0.20258
555245,NORTH PARK POST-ACUTE,CA,0.16116,0.20259
056326,BURLINGTON CONVALESCENT HOSPITAL,CA,0.17947,0.20259
146118,PRAIRIEVIEW AT THE GARLANDS,IL,0.1885,0.2026
515189,FAIRMONT HEALTHCARE AND REHABILITATION CENTER,WV,0.19857,0.2026
165557,DEERFIELD HEALTH CARE CENTER,IA,0.20276,0.2026
315387,ALLAIRE REHAB & NURSING,NJ,0.17886,0.2026
055204,OAKWOOD GARDENS CARE CENTER,CA,0.18591,0.20261
145367,GILLESPIE HEALTH & REHAB CTR,IL,0.17999,0.20261
145807,HELIA HEALTHCARE OF NEWTON,IL,0.21634,0.20261
365656,LAURELS OF NEW LONDON THE,OH,0.19212,0.20262
215351,LORIEN MAYS CHAPEL,MD,0.2054,0.20262
145783,SUNRISE SKILLED NUR & REHAB,IL,0.22069,0.20262
056101,RIVER POINTE POST-ACUTE,CA,0.23032,0.20263
445521,REGIONAL ONE HEALTH SUBACUTE CARE,TN,,0.20263
425168,CARLYLE SENIOR CARE OF FOUNTAIN INN,SC,0.20966,0.20263
185124,REDBANKS,KY,0.20276,0.20264
345226,PEAK RESOURCES-OUTER BANKS,NC,0.2183,0.20265
676490,SYLVAN SHORES HEALTH AND WELLNESS,TX,,0.20267
225653,COPLEY AT STOUGHTON NURSING CARE CENTER,MA,0.21352,0.20267
155831,BRIARCLIFF HEALTH & REHABILITATION CENTER,IN,0.1914,0.20268
255145,COURTYARD REHABILITATION AND HEALTHCARE,MS,0.20988,0.20268
365663,GENOA RETIREMENT VILLAGE,OH,0.21181,0.20269
396096,MORAVIAN VILLAGE OF BETHLEHEM,PA,0.19424,0.20269
455869,GUADALUPE VALLEY NURSING CENTER,TX,0.19072,0.20269
555066,"GREENFIELD CARE CENTER OF FILLMORE, LLC",CA,0.23033,0.2027
375488,THE COMMONS,OK,0.17321,0.2027
365603,AVENTURA AT WEST PARK,OH,0.20935,0.20271
065222,BOULDER CANYON HEALTH AND REHABILITATION,CO,,0.20273
525662,MORROW MEMORIAL HOME,WI,0.18174,0.20274
555723,SANTA FE POST-ACUTE,CA,0.19302,0.20274
195502,RIVER OAKS RETIREMENT MANOR,LA,0.19566,0.20274
235422,REGENCY AT CHENE,MI,,0.20274
145666,CENTRALIA MANOR,IL,0.22341,0.20274
055566,COASTAL VIEW HEALTHCARE CENTER,CA,0.20541,0.20276
235666,REGENCY AT GRAND BLANC,MI,0.22162,0.20276
555857,OAKVIEW SKILLED NURSING,CA,0.19804,0.20276
155222,KOKOMO HEALTHCARE CENTER,IN,0.19791,0.20277
375381,BAPTIST VILLAGE OF OKLAHOMA CITY,OK,0.21309,0.20277
415032,CEDAR CREST NURSING CENTRE INC,RI,0.22054,0.20277
366047,RAE ANN GENEVA,OH,0.19001,0.20278
105692,VIVO HEALTHCARE ORANGE PARK,FL,0.19368,0.20278
335540,THE GRAND REHABILITATION AND NRSG AT GUILDERLAND,NY,0.20448,0.2028
395821,LITTLE FLOWER MANOR,PA,0.19225,0.2028
676135,PRESBYTERIAN VILLAGE NORTH SPECIAL CARE CTR,TX,0.20924,0.20281
015012,HIGHLANDS HEALTH AND REHAB,AL,0.22385,0.20281
105399,SEA BREEZE REHAB AND NURSING CENTER,FL,0.18206,0.20283
265645,COUNTRY CLUB REHAB AND HEALTHCARE CENTER,MO,0.19762,0.20283
255289,RIVER CHASE VILLAGE,MS,0.19997,0.20284
315359,ALLIANCE CARE REHABILITATION AND NURSING CENTER,NJ,0.20905,0.20285
675170,LA PALOMA NURSING CENTER,TX,,0.20286
035251,RIVER PARK POST ACUTE,AZ,0.21264,0.20286
155607,BETHEL MANOR,IN,,0.20286
185221,SALYERSVILLE NURSING AND REHABILITATION CENTER,KY,0.20765,0.20287
676183,HUNTINGTON HEALTH CARE & REHABILITATION CENTER,TX,0.18083,0.20287
395768,MEADOWOOD,PA,0.21862,0.20288
345169,THE GREENS AT GASTONIA,NC,0.17768,0.20288
555104,CONCORD POST ACUTE,CA,,0.20289
195578,EVANGELINE OAKS GUEST HOUSE,LA,0.21881,0.2029
155208,APERION CARE HANOVER,IN,0.2103,0.20291
445326,LIFE CARE CENTER OF BRUCETON-HOLLOW ROCK,TN,0.20903,0.20291
445522,WATERS OF MEMPHIS A REHABILITATION & NURSING CTR,TN,0.17189,0.20292
105949,FLORIDA PRESBYTERIAN HOMES INC,FL,0.24978,0.20292
155793,HAMILTON TRACE OF FISHERS,IN,0.20406,0.20292
305071,SAINT TERESA REHABILITATION & NURSING CENTER,NH,0.20537,0.20293
075135,MASONICARE HEALTH CENTER,CT,0.20044,0.20294
375464,ADA CARE CENTER,OK,0.24963,0.20295
035016,HANDMAKER HOME FOR THE AGING,AZ,0.22605,0.20295
055449,COVINA REHABILITATION CENTER,CA,0.21053,0.20295
395277,HARBORVIEW REHABILITATION CARE CENTER AT DOYLESTOW,PA,0.1895,0.20295
285087,TIFFANY SQUARE,NE,0.19287,0.20295
055753,LONGWOOD MANOR CONV.HOSPITAL,CA,0.20372,0.20298
425070,MYRTLE BEACH MANOR,SC,0.1975,0.20298
265340,LIFE CARE CENTER OF SULLIVAN,MO,0.19716,0.20299
345391,HEARTLAND LIVING & REHAB AT THE MOSES H CONE MEM H,NC,0.20712,0.20299
676313,LAREDO NURSING AND REHABILITATION CENTER,TX,0.1718,0.20299
525346,WILLIAMS BAY HEALTH SERVICES,WI,0.19637,0.20299
395483,MARKLEY REHABILITATION AND HEALTHCARE CENTER,PA,,0.20299
395249,HAMPTON HOUSE REHABILITATION AND NURSING CENTER,PA,0.19431,0.203
315283,SOUTH MOUNTAIN HC,NJ,0.19656,0.203
315264,"COMPLETE CARE AT BEY LEA, LLC",NJ,0.17458,0.203
235566,MEDILODGE OF CHEBOYGAN,MI,0.18011,0.20301
185057,SUNRISE MANOR NURSING HOME,KY,0.19691,0.20302
265495,ST CLAIR NURSING CENTER,MO,0.18574,0.20302
515191,BELMONT HEALTHCARE CENTER,WV,0.18098,0.20302
155654,ENGLEWOOD HEALTH & REHABILITATION CENTER,IN,,0.20302
145878,ST PATRICK'S RESIDENCE,IL,0.22323,0.20302
115283,EAST COBB CENTER FOR NURSING AND HEALING LLC,GA,0.2079,0.20303
335508,SKY VIEW REHABILITATION & HEALTH CARE CENTER L L C,NY,0.18656,0.20303
495255,SKYVIEW SPRINGS REHAB AND NURSING CENTER,VA,0.15707,0.20303
365652,COTTINGHAM RETIREMENT COMMUNITY,OH,0.18976,0.20304
056040,ESCONDIDO POST ACUTE REHAB,CA,0.20226,0.20304
445251,AHC WAVERLY,TN,0.20793,0.20305
676107,CORPUS CHRISTI NURSING AND REHABILITATION CENTER,TX,0.2328,0.20305
055288,AUTUMN HILLS HEALTH CARE CENTER,CA,0.16442,0.20306
225283,WEBSTER MANOR REHABILITATION & HEALTH CARE CENTER,MA,0.21888,0.20307
035073,"HAVEN HEALTH GREEN VALLEY, LLC",AZ,0.18701,0.20307
335373,BAINBRIDGE NURSING & REHABILITATION CENTER,NY,0.20148,0.20307
366143,ADAMS COUNTY MANOR,OH,0.22018,0.20307
366365,WILLOWS AT BELLEVUE,OH,0.1956,0.20308
235429,THE VILLA AT THE BAY,MI,0.19229,0.20308
335778,THE HIGHLANDS AT BRIGHTON,NY,0.19519,0.20309
145548,COMMUNITY FIRST MEDICAL CENTER,IL,0.19331,0.20309
185437,"THE VILLAGE OF LEBANON II, LLC",KY,0.19525,0.20309
055261,PILGRIM PLACE HEALTH SERVICES CENTER,CA,0.19591,0.2031
395237,WYOMISSING HEALTH AND REHABILITATION CENTER,PA,0.1736,0.2031
065165,RIVERBEND HEALTH AND REHABILITATION CENTER,CO,0.19916,0.2031
215094,WESTMINSTER HEALTHCARE CENTER,MD,0.18732,0.20311
345210,ELIZABETHTOWN HEALTHCARE & REHAB CENTER,NC,0.17415,0.20311
245083,THE VILLAS AT THE PARK,MN,0.18896,0.20312
146032,FAIRVIEW REHAB & HEALTHCARE,IL,0.22665,0.20312
495015,ROMAN EAGLE REHABILITATION AND HEALTH CARE CENTER,VA,0.20468,0.20313
555164,ARBOR REHABILITATION & NURSING CENTER,CA,0.19776,0.20314
555535,RIVER VALLEY CARE CENTER,CA,0.18547,0.20314
056259,NORTHVINE POSTACUTE CARE,CA,0.17384,0.20314
335176,ROSA COPLON JEWISH HOME AND INFIRMARY,NY,0.16715,0.20314
105649,CYPRESS CARE CENTER,FL,0.1688,0.20315
146102,MANOR COURT OF FREEPORT,IL,0.20475,0.20315
385172,THE DALLES HEALTH & REHABILITATION CENTER,OR,0.18848,0.20316
105539,HEALTHCARE AND REHAB OF SANFORD,FL,0.22511,0.20316
395541,SINKING SPRING SKILLED NURSING AND REHABILITATION,PA,0.20224,0.20317
315427,UNITED METHODIST COMMUNITIES AT PITMAN,NJ,0.19102,0.20317
165362,CLARION WELLNESS AND REHABILITATION CENTER,IA,0.18425,0.20318
335372,"NEW VANDERBILT REHABILITATION AND CARE CENTER, INC",NY,0.18145,0.20318
365093,GOOD SHEPHERD THE,OH,0.20841,0.20319
145710,MEADOWBROOK MANOR,IL,0.15606,0.20319
265303,IGNITE MEDICAL RESORT CARONDELET LLC,MO,0.21426,0.20319
425408,WHITE OAK AT NORTH GROVE INC,SC,0.20379,0.20319
155135,WESTVIEW NURSING AND REHABILITATION CENTER,IN,0.20153,0.20319
245328,PARMLY ON THE LAKE LLC,MN,0.20381,0.20319
155754,HUBBARD HILL ESTATES INC,IN,0.19309,0.2032
045403,NIGHTINGALE AT GLENWOOD,AR,0.21003,0.2032
235567,HILLSDALE HOSPITAL MCGUIRE AND MACRITCHIE LTCU,MI,0.19125,0.20321
345162,ACCORDIUS HEALTH AT GASTONIA,NC,0.19962,0.20322
555016,ST JOHN KRONSTADT CONVALESCENT CENTER,CA,0.18841,0.20323
105449,MIAMI SHORES NURSING AND REHAB CENTER,FL,0.19278,0.20323
395718,WAVERLY HEIGHTS,PA,0.19753,0.20324
345406,ACCORDIUS HEALTH AND REHABILITATION,NC,0.19309,0.20325
366415,OHIO LIVING CAPE MAY,OH,0.22945,0.20326
146134,SALINE CARE NURSING & REHAB,IL,0.20675,0.20326
055887,RIVER BEND NURSING CENTER,CA,0.21442,0.20326
265474,COUNTRY AIRE RETIREMENT CENTER,MO,0.1886,0.20327
525712,CARE AND REHAB - CUMBERLAND,WI,,0.20327
175562,RANCH HOUSE SENIOR LIVING LLC,KS,0.20142,0.20327
145222,HIGHLIGHT HLTHCR OF WOODSTOCK,IL,0.21349,0.20327
