PROVIDER_ID,PROVIDER_NAME,STATE,BASELINE_READMISSION_RATE,PERFORMANCE_READMISSION_RATE
365785,WILLOWOOD CARE CENTER OF BRUNSWICK,OH,0.20409,0.21363
345412,BRANTWOOD NH & RETIREMENT CENT,NC,0.17884,0.21364
155483,"WATERS OF RISING SUN, THE",IN,0.20356,0.21365
155757,ROSEGATE VILLAGE,IN,0.21148,0.21365
015460,CHARLTON PLACE REHAB AND HEALTHCARE CENTER,AL,0.16385,0.21366
525396,GREENWAY MANOR,WI,0.21868,0.21366
155682,WOODMONT HEALTH CAMPUS,IN,0.20808,0.21366
315522,ACCELERATE SKILLED NURSING AND REHAB PISCATAWAY,NJ,0.17371,0.21367
045390,PLEASANT VALLEY REHABILITATION AND NURSING,AR,0.2288,0.21367
105375,SOUTH CAMPUS CARE CENTER AND REHAB,FL,0.1848,0.21367
105687,SOLARIS HEALTHCARE PARKWAY,FL,0.21182,0.21367
395558,ST MONICA CENTER FOR REHABILITATION & HEALTHCARE,PA,0.23119,0.21368
335421,TARRYTOWN HALL CARE CENTER,NY,0.19286,0.21369
395370,LUTHER WOODS NURSING AND REHABILITATION CENTER,PA,0.19293,0.21371
145339,"GROVE OF ELMHURST, THE",IL,0.21833,0.21372
675972,CARROLLTON HEALTH AND REHABILITATION CENTER,TX,0.19033,0.21372
146195,IGNITE MEDICAL MCHENRY,IL,,0.21372
245591,GOOD SAMARITAN SOCIETY - PIPESTONE,MN,0.19047,0.21373
396115,WYNDMOOR HILLS REHABILITATION AND NURSING CENTER,PA,0.21694,0.21374
505195,NORTH AUBURN REHAB & HEALTH CENTER,WA,0.19794,0.21375
105552,SANDY RIDGE CENTER FOR REHABILITATION AND HEALING,FL,0.22889,0.21376
265565,PLEASANT HILL HEALTH AND REHABILITATION CENTER,MO,0.19739,0.21377
555342,SUNNY VIEW MANOR,CA,0.1616,0.21377
225395,LANESSA EXTENDED CARE,MA,,0.21378
145329,NORRIDGE GARDENS,IL,0.18203,0.21378
235635,CARETEL INNS OF TRI-CITIES,MI,0.24178,0.21378
115635,RIVER BROOK HEALTHCARE CENTER,GA,0.19779,0.21379
045413,METHODIST HEALTH AND REHAB,AR,0.20726,0.2138
225271,PORT HEALTHCARE CENTER,MA,0.22904,0.21381
265118,ASPEN POINT HEALTH AND REHABILITATION,MO,0.19092,0.21381
105395,WESTWOOD NURSING AND REHABILITATION CENTER,FL,0.22357,0.21383
335847,HOPKINS CENTER FOR REHABILITATION AND HEALTHCARE,NY,0.17939,0.21383
105354,LAKELAND NURSING & REHABILITATION,FL,0.20609,0.21383
335676,"HAVEN MANOR HEALTH CARE CENTER, L L C",NY,,0.21383
395603,CARING HEIGHTS COMMUNITY CARE & REHAB CTR,PA,0.19526,0.21384
676197,RIDGEVIEW REHABILITATION AND SKILLED NURSING,TX,0.20442,0.21385
146194,THRIVE OF FOX VALLEY,IL,,0.21386
015443,ROBERTSDALE REHABILITATION & HEALTHCARE CTR,AL,0.23827,0.21386
375476,COVENANT LIVING AT INVERNESS,OK,0.20895,0.21386
145532,BIRCHWOOD PLAZA,IL,0.18672,0.21388
145403,ALDEN POPLAR CREEK REHAB & HCC,IL,0.21721,0.21388
195522,"GOLDEN AGE OF WELSH, LLC",LA,0.19286,0.2139
185171,PARKVIEW NURSING & REHABILITATION CENTER,KY,0.25302,0.21391
395674,UNIONTOWN HEALTHCARE AND REHABILITATION CENTER,PA,0.18789,0.21391
315177,GATEWAY CARE CENTER,NJ,0.21394,0.21392
155614,LINCOLN HILLS OF NEW ALBANY,IN,0.22102,0.21392
105447,BEDROCK REHABILITATION AND NURSING CENTER AT WEST,FL,0.18527,0.21392
185215,PINE MEADOWS POST ACUTE,KY,0.21352,0.21393
115513,TWIN OAKS CONVALESCENT CENTER,GA,0.20832,0.21394
365286,CARINGTON PARK,OH,0.21483,0.21394
315352,ALARIS HEALTH AT ST MARY'S,NJ,0.17392,0.21397
145636,CHARLESTON REHAB & HEALTH CC,IL,0.20516,0.21397
055548,PASADENA PARK HEALTHCARE AND WELLNESS CENTER,CA,0.18534,0.21398
555713,MEADOWOOD A HEALTH AND REHABILITATION CENTER,CA,0.18101,0.21398
106033,ST PETERSBURG NURSING & REHABILITATION,FL,0.18,0.21398
525465,CEDAR LAKE HEALTH AND REHAB CENTER,WI,0.22998,0.214
155830,HARRISON'S CROSSING HEALTH CAMPUS,IN,0.16294,0.214
105673,INDIAN RIVER CENTER,FL,0.20917,0.214
345070,DURHAM NURSING & REHABILITATION CENTER,NC,0.20104,0.214
285054,THE BANYAN AT MONTCLAIR,NE,0.20969,0.214
335554,"THE BRIGHTONIAN, INC",NY,0.20217,0.21401
515171,LINCOLN HEALTHCARE CENTER,WV,0.18288,0.21401
396056,WILLIAM PENN CARE CENTER,PA,0.19575,0.21401
155143,MAJESTIC CARE OF TERRE HAUTE,IN,0.20148,0.21402
555839,DREIER'S NURSING CARE CENTER,CA,0.21092,0.21403
185388,MASONIC HOME OF LOUISVILLE,KY,0.19092,0.21403
345311,ROXBORO HEALTHCARE & REHAB CENTER,NC,0.18642,0.21403
365538,FRIENDS EXTENDED CARE CENTER,OH,0.20517,0.21405
185279,MILLS NURSING & REHABILITATION,KY,0.20089,0.21405
305061,CRESTWOOD CENTER,NH,0.21839,0.21406
146101,WILLOWS HEALTH CENTER,IL,0.21623,0.21406
225117,ROYAL OF FAIRHAVEN NURSING CENTER,MA,0.21456,0.21406
345511,AUTUMN CARE OF STATESVILLE,NC,0.18125,0.21406
165614,ROSE HAVEN NURSING HOME,IA,,0.21409
555054,PACIFIC POST ACUTE,CA,0.2019,0.2141
495118,ROCKY MOUNT HEALTH & REHAB CENTER,VA,0.18701,0.21412
015162,"TALLADEGA HEALTHCARE CENTER, INC",AL,0.22749,0.21412
055407,CUPERTINO HEALTHCARE & WELLNESS CENTER,CA,0.18661,0.21412
265363,RIVERWAYS MANOR,MO,,0.21413
395386,BETHANY VILLAGE RETIREMENT CENTER,PA,0.19955,0.21414
315366,ALARIS HEALTH AT BELGROVE,NJ,0.16923,0.21415
676238,LEGEND OAKS HEALTHCARE AND REHABILITATION - NORTH,TX,0.18881,0.21415
375256,MEADOWLAKE ESTATES,OK,0.2036,0.21415
056148,CASITAS CARE CENTER,CA,0.19975,0.21417
495266,HANOVER HEALTH AND REHABILITATION CENTER,VA,0.2119,0.21418
105407,SIESTA KEY HEALTH AND REHABILITATION CENTER,FL,0.19768,0.21419
425052,NHC HEALTHCARE -  ANDERSON,SC,0.21202,0.21419
676247,SANDY LAKE REHABILITATION AND CARE CENTER,TX,0.19669,0.21421
145827,"BRITISH HOME, THE",IL,0.20927,0.21421
375489,THE COTTAGE EXTENDED CARE,OK,0.17567,0.21422
225538,ROYAL CAPE COD NURSING & REHABILITATION CENTER,MA,0.19387,0.21423
366195,BEEGHLY OAKS CENTER FOR REHABILITATION & HEALING,OH,0.18937,0.21423
075047,"HEWITT HEALTH & REHABILITATION CENTER, INC",CT,0.19296,0.21423
676368,TREVISO TRANSITIONAL CARE,TX,0.22826,0.21425
395200,WALNUT CREEK HEALTHCARE AND REHABILITATION CENTER,PA,0.20069,0.21425
235520,MONROE SPRINGS SKILLED NURSING AND REHAB,MI,0.2011,0.21425
225409,NEVINS NURSING & REHABILITATION CENTER,MA,0.23121,0.21425
035126,LIFE CARE CENTER OF NORTH GLENDALE,AZ,0.1819,0.21425
055298,FALLBROOK SKILLED NURSING,CA,0.20045,0.21426
105307,PARKVIEW REHABILITATION CENTER AT WINTER PARK,FL,0.18539,0.21426
365611,LEGACY WESTERVILLE,OH,0.18163,0.21426
146125,"OAKS HEALTH CARE CENTER, THE",IL,0.20546,0.21426
215130,FAIRHAVEN,MD,0.20142,0.21428
075336,SOUTHINGTON CARE CENTER,CT,0.19132,0.21429
155233,"WATERS OF BATESVILLE, THE",IN,0.18064,0.21429
415081,WESTERLY HEALTH CENTER,RI,0.18578,0.21429
395404,"LECOM AT PRESQUE ISLE, INC",PA,0.2033,0.21429
385268,GATEWAY CARE AND RETIREMENT,OR,,0.21429
245581,FAIR OAKS NURSING & REHAB LLC,MN,0.19276,0.21429
555461,MARINA GARDEN NURSING CENTER,CA,0.19196,0.2143
676189,THE LEGACY AT WILLOW BEND,TX,0.19735,0.21432
315339,CAREONE AT ORADELL,NJ,0.17605,0.21434
465094,SANDSTONE MILLCREEK,UT,0.19364,0.21435
675703,CROSS TIMBERS REHABILITATION AND HEALTHCARE CENTER,TX,0.21667,0.21436
675175,PARK MANOR OF MCKINNEY,TX,0.22237,0.21437
145688,PRINCETON REHAB & HCC,IL,,0.21437
105408,TREASURE ISLE CARE CENTER,FL,0.21544,0.21437
145422,FAIR HAVENS SENIOR LIVING,IL,0.19375,0.21437
165260,ASPIRE OF DONNELLSON,IA,0.20945,0.21437
525711,PRIDE TLC THERAPY AND LIVING CAMPUS,WI,0.20743,0.21438
155790,BRIDGEWATER HEALTHCARE CENTER,IN,0.1903,0.21438
355033,ST CATHERINES LIVING CENTER,ND,0.20235,0.21438
395650,WARREN MANOR,PA,0.19063,0.21439
145789,ALLURE OF GENESEO,IL,,0.21439
265245,COLONIAL SPRINGS HEALTHCARE CENTER,MO,0.18951,0.21439
115419,"OAKS - ATHENS SKILLED NURSING, THE",GA,0.20178,0.21441
145680,CELEBRATE SR LIVING OF MOLINE,IL,0.22512,0.21442
345124,PRUITTHEALTH-ELKIN,NC,0.20229,0.21442
235480,THE ORCHARDS AT HARPER WOODS,MI,0.19589,0.21443
676250,PECAN VALLEY REHABILITATION AND HEALTHCARE,TX,0.20838,0.21444
265351,LANSDOWNE VILLAGE,MO,0.22791,0.21444
155187,BRICKYARD HEALTHCARE - PORTAGE CARE CENTER,IN,0.19712,0.21446
145932,CITADEL CARE CENTER-WILMETTE,IL,0.18914,0.21447
235526,BOULDER PARK TERRACE,MI,0.17804,0.21448
115624,THUNDERBOLT CARE CENTER LLC,GA,0.18033,0.21449
195604,COLONIAL OAKS SKILLED NURSING AND REHABILITATION,LA,0.24785,0.21449
105487,BAY BREEZE SENIOR LIVING AND REHABILITATION CENTER,FL,0.23062,0.2145
465111,SANDY HEALTH AND REHAB,UT,0.17849,0.2145
395278,SAINT JOSEPH VILLA,PA,0.20386,0.2145
185443,KENSINGTON NURSING AND REHABILITATION CENTER,KY,0.20123,0.21451
395851,REHAB & NURSING CTR GREATER PITTSBURGH,PA,0.23801,0.21451
455643,MATAGORDA HOUSE HEALTHCARE CENTER,TX,0.19651,0.21452
115701,CHATUGE REGIONAL NURSING HOME,GA,0.20367,0.21452
255207,PLAZA COMMUNITY LIVING CENTER,MS,0.21671,0.21452
105917,ASPIRE AT JACKSONVILLE,FL,0.2206,0.21452
315463,MEADOWBROOK RESPIRATORY AND NURSING CENTER,NJ,0.20374,0.21453
365843,KENTON NURSING AND REHABILITATION CENTER,OH,0.18807,0.21455
215352,COFFMAN NURSING HOME,MD,0.20845,0.21455
105145,PARKSIDE HEALTH AND REHABILITATION CENTER,FL,0.19744,0.21456
445387,PARKWAY HEALTH AND REHABILITATION CENTER,TN,0.20248,0.21456
255333,GEORGE REGIONAL HEALTH & REHAB CENTER,MS,0.21794,0.21456
215065,BEL PRE HEALTHCARE CENTER,MD,,0.21457
515064,PLEASANT VALLEY HEALTHCARE CENTER,WV,0.20361,0.21457
165302,LINN HAVEN REHAB & HEALTHCARE,IA,0.18915,0.21457
345323,WALLACE REHABILITATION AND HEALTHCARE CENTER,NC,,0.21458
225332,ADVINIACARE NEWBURYPORT,MA,0.19904,0.21458
115677,PRUITTHEALTH - JASPER,GA,0.19907,0.21458
365044,ARCAT CINCINNATI,OH,0.1964,0.21458
445160,SMYRNA CARE CENTER,TN,0.19748,0.21459
075070,APPLE REHAB SAYBROOK,CT,0.21529,0.21459
235464,NORTH WOODS NURSING CENTER,MI,0.20117,0.2146
365346,OTTERBEIN LEBANON RETIREMENT COMMUNITY,OH,0.18221,0.2146
415113,TOCKWOTTON ON THE WATERFRONT,RI,0.19179,0.2146
245624,ALLINA HEALTH RESTORATIVE SUITES,MN,0.19926,0.21461
366171,CRIDERSVILLE HEALTHCARE CENTER,OH,,0.21462
515166,CLARKSBURG HEALTHCARE CENTER,WV,0.22645,0.21464
045372,THE BLOSSOMS AT WHITE HALL REHAB & NURSING CENTER,AR,0.20157,0.21465
365674,ARBORS AT MINERVA,OH,0.19575,0.21466
675834,BROOKDALE GALLERIA,TX,0.2036,0.21467
335199,RESORT NURSING HOME,NY,0.20011,0.21467
395298,LAKEWOOD REHABILITATION & HEALTHCARE CENTER,PA,0.21846,0.21469
335827,THE GRAND REHABILITATION AND NRSG AT RIVER VALLEY,NY,0.18382,0.21469
265188,SPRING VALLEY HEALTH & REHABILITATION CENTER,MO,0.19254,0.2147
365155,AVON PLACE,OH,0.18696,0.2147
195247,ADIRA MEDICAL RESORT,LA,0.2062,0.21471
425097,PRUITTHEALTH- BARNWELL,SC,0.18892,0.21471
335549,WARREN CENTER FOR REHABILITATION AND NURSING,NY,0.23496,0.21471
045203,THE SPRINGS BATESVILLE,AR,0.1927,0.21471
055523,GLENDALE POST ACUTE CENTER,CA,0.18635,0.21471
105707,FOURAKER HILLS REHAB AND NURSING CENTER,FL,0.21183,0.21472
315469,CONTINUING CARE AT SEABROOK,NJ,0.20095,0.21473
676422,PALOMINO PLACE,TX,0.19581,0.21473
555344,BRUCEVILLE TERRACE - D/P SNF OF METHODIST HOSPITAL,CA,0.17513,0.21473
366040,DOVERWOOD VILLAGE,OH,0.24496,0.21474
105005,CORAL GABLES NURSING AND REHABILITATION CENTER,FL,0.19266,0.21474
225603,SOUTHPOINTE REHAB CENTER,MA,0.19866,0.21475
455592,WEST SIDE CAMPUS OF CARE,TX,0.17877,0.21475
676314,CAPSTONE HEALTHCARE ESTATES ON OREM,TX,0.19905,0.21476
215129,AUTUMN LAKE HEALTHCARE AT PARKVILLE,MD,0.17465,0.21477
225503,"PAVILION , THE",MA,0.19395,0.21478
145887,ALTA REHAB AT WAUCONDA,IL,0.21384,0.21478
056351,CHATSWORTH PARK HEALTH CARE CENTER,CA,0.22911,0.21479
015315,"RIDGEWOOD HEALTH SERVICES, INC.",AL,0.22152,0.2148
366352,EMERALD POINTE HEALTH AND REHAB CTR,OH,0.19975,0.2148
145760,ROBINSON REHAB AND NURSING,IL,0.18916,0.2148
055619,LAS COLINAS POST ACUTE,CA,0.20572,0.21481
015076,FAIR HAVEN,AL,0.17275,0.21481
105321,OCALA HEALTH AND REHABILITATION CENTER,FL,0.1902,0.21481
235292,MEDILODGE OF SAULT STE MARIE,MI,0.17126,0.21482
315413,PEACE CARE ST ANN'S,NJ,0.23918,0.21483
185447,VILLASPRING OF ERLANGER,KY,0.22373,0.21483
295092,ADVANCED HEALTH CARE OF SUMMERLIN,NV,0.22062,0.21484
055846,THE TERRACES AT SAN JOAQUIN GARDENS VILLAGE,CA,0.17343,0.21485
015463,KNOLLWOOD HEALTHCARE,AL,0.18745,0.21485
365669,FOUR WINDS NURSING FACILITY,OH,0.18731,0.21485
335798,TOWNHOUSE CENTER FOR REHABILITATION & NURSING,NY,0.1712,0.21487
015139,"TALLASSEE HEALTH AND REHABILITATION, LLC",AL,0.18213,0.21488
235375,APPLEWOOD NURSING CENTER INC,MI,0.20664,0.21489
495197,BELVOIR WOODS HEALTH CARE CENTER AT THE FAIRFAX,VA,0.202,0.21489
235471,LIFE CARE CENTER OF PLAINWELL,MI,0.19484,0.21489
365277,BRADFORD PLACE CARE CENTER,OH,0.22941,0.21491
115720,EVERGREEN HEALTH AND REHABILITATION CENTER,GA,0.19617,0.21492
445448,SIGNATURE HEALTHCARE OF CLARKSVILLE,TN,0.19172,0.21494
185272,RIVER HAVEN NURSING AND REHABILITATION CENTER,KY,0.20469,0.21495
035231,SIERRA WINDS,AZ,0.20733,0.21495
366000,SYCAMORESPRING OF MIAMISBURG,OH,0.18978,0.21497
415008,GREENWOOD CENTER,RI,0.20661,0.21498
525442,TOMAH NURSING AND REHAB,WI,0.20194,0.21499
265518,WINDSOR ESTATES OF ST CHARLES,MO,0.20815,0.215
105924,BLOUNTSTOWN HEALTH AND REHABILITATION CENTER,FL,0.21228,0.21501
235359,FAITH HAVEN SENIOR CARE CENTRE,MI,0.21541,0.21501
235004,SKLD MUSKEGON,MI,0.19342,0.21502
675641,NESBIT LIVING & RECOVERY CENTER,TX,0.19493,0.21502
335040,PINE FOREST CARE CENTER FOR REHAB & HEALTHCARE,NY,0.19144,0.21502
255270,PONTOTOC HEALTH & REHAB CENTER,MS,0.18813,0.21502
335700,NORTH SHORE - L I J ORZAC CTR FOR REHABILITATION,NY,0.19198,0.21503
295006,LAS VEGAS POST ACUTE & REHABILITATION,NV,0.1869,0.21505
366375,MASTERNICK MEMORIAL HEALTH CARE CENTER,OH,0.23798,0.21506
185089,SIGNATURE HEALTHCARE OF BOWLING GREEN,KY,0.20019,0.21507
365844,AURORA MANOR SPECIAL CARE CENT,OH,0.19036,0.21507
375460,"MONTEREAU, INC",OK,0.21166,0.21507
395961,PHILADELPHIA PROTESTANT HOME,PA,0.20335,0.21507
676319,CORINTH REHABILITATION SUITES ON THE PARKWAY,TX,0.22691,0.21508
675028,ESTATES HEALTHCARE AND REHABILITATION CENTER,TX,0.18558,0.21508
265880,IGNITE MEDICAL RESORT BLUE SPRINGS,MO,,0.21508
345383,SCOTTISH PINES REHABILITATION AND NURSING CENTER,NC,0.21168,0.21508
315105,CORAL HARBOR REHABILITATION AND HEALTHCARE CENTER,NJ,0.20398,0.21509
145629,PRAIRIE MANOR NRSG & REHAB CTR,IL,0.19658,0.21509
345478,HARNETT WOODS NURSING AND REHABILITATION CENTER,NC,0.16622,0.21509
056151,"GREENFIELD CARE CENTER OF FULLERTON, LLC",CA,0.18193,0.2151
675667,UNIVERSITY PLACE NURSING CENTER,TX,0.21615,0.2151
145338,WESTMONT MANOR HLTH & RHB,IL,0.17759,0.21511
315268,BROOKHAVEN HEALTH CARE CENTER,NJ,0.21054,0.21511
145953,PRAIRIEVIEW LUTHERAN HOME,IL,0.19359,0.21512
675944,OAK RIDGE MANOR,TX,0.17413,0.21512
145837,PITTSFIELD MANOR,IL,0.17933,0.21513
055315,GRANT CUESTA SUB-ACUTE AND REHABILITATION CENTER,CA,0.18014,0.21513
145334,ZAHAV OF DES PLAINES,IL,0.19541,0.21514
155742,ST ANDREWS HEALTH CAMPUS,IN,0.19338,0.21516
525549,HERITAGE SQUARE HEALTH CARE CENTER,WI,0.17893,0.21517
325129,DESERT SPRINGS HEALTH CARE,NM,0.20193,0.21517
395760,CEDAR CREST POST ACUTE,PA,0.17967,0.21517
105464,ANCHOR CARE & REHABILITATION CENTER,FL,0.20427,0.21518
455486,ENNIS CARE CENTER,TX,0.19936,0.21519
185274,WEST LIBERTY NURSING AND REHABILITATION,KY,,0.21519
115502,GRANDVIEW HEALTH CARE CENTER,GA,0.21209,0.21521
315525,HARBOUR VIEW SENIOR LIVING CORP,NJ,0.20084,0.21522
315215,GREENWOOD HOUSE HOME FOR THE JEWISH AGED,NJ,0.20135,0.21524
676025,AUTUMN LEAVES NURSING AND REHAB INC,TX,0.20708,0.21524
445480,THE WATERS OF SPRINGFIELD LLC,TN,,0.21525
225272,BEAR HILL HEALTHCARE AND REHABILITATION CENTER,MA,0.20971,0.21526
455670,RIDGECREST RETIREMENT AND HEALTHCARE COMMUNITY,TX,0.19766,0.21527
185342,SIGNATURE HEALTHCARE AT COLONIAL REHAB & WELLNESS,KY,0.17638,0.21527
335096,NEW RIVERDALE REHAB AND NURSING,NY,0.21497,0.21527
115345,PRUITTHEALTH - TOCCOA,GA,0.20838,0.21528
055056,"PINE GROVE HEALTHCARE & WELLNESS CENTRE, LP",CA,0.18342,0.21528
366486,ROCKLAND RIDGE NURSING & REHABILITATION CENTER,OH,,0.21528
115533,PRUITTHEALTH - SWAINSBORO,GA,0.18165,0.21529
315231,THE CENTER FOR REHAB & NURSING WASHINGTON TOWNSHIP,NJ,0.2345,0.21529
395535,LAUREL SQUARE HEALTHCARE AND REHABILITATION CENTER,PA,0.20745,0.2153
315183,PREMIER CADBURY OF CHERRY HILL,NJ,0.22766,0.21531
676352,STONEMERE REHABILITATION CENTER,TX,0.21134,0.21532
505409,SUMMITVIEW REHAB AND HEALTH CENTER,WA,0.18946,0.21532
365880,SIGNATURE HEALTHCARE OF COSHOCTON,OH,0.20554,0.21533
445320,ELK RIVER HEALTH & REHABILITATION OF FAYETTEVILLE,TN,,0.21533
455533,WINDCREST NURSING AND REHABILITATION,TX,0.19226,0.21533
155202,"WATERS OF GREENCASTLE, THE",IN,0.19425,0.21534
145502,TAYLORVILLE CARE CENTER,IL,0.17683,0.21534
055750,WESTWOOD POST ACUTE,CA,0.18685,0.21534
225667,PLEASANT BAY OF BREWSTER REHAB CENTER,MA,0.20521,0.21534
105421,WOODSIDE HEALTH AND REHABILITATION CENTER,FL,0.20696,0.21535
146030,HEARTLAND SENIOR LIVING,IL,0.21913,0.21535
225467,REGALCARE AT WORCESTER,MA,0.20107,0.21536
365452,PEARLVIEW REHAB & WELLNESS CTR,OH,,0.21536
105602,HAWTHORNE CENTER FOR REHABILITATION AND HEALING OF,FL,0.21008,0.2154
075183,COMPLETE CARE AT FOX HILL,CT,0.18616,0.21541
065219,BROADVIEW HEALTH AND REHABILITATION CENTER,CO,0.18556,0.21541
676252,CAPSTONE HEALTHCARE ESTATES AT VETERANS MEMORIAL,TX,0.20284,0.21542
265504,"CURRENT RIVER NURSING CENTER, INC",MO,0.23765,0.21542
215160,ELLICOTT CITY HEALTHCARE CENTER,MD,0.17246,0.21543
345026,ROYAL PARK REHAB & HEALTH CTR OF MATTHEWS,NC,0.17628,0.21543
676195,FALCON POINT POST ACUTE,TX,0.20975,0.21544
265255,CLINTON HEALTHCARE AND REHABILITATION CENTER,MO,0.2005,0.21544
105372,"AVANTE AT LAKE WORTH, INC.",FL,0.2168,0.21544
056430,NORTHGATE POSTACUTE CARE,CA,0.19507,0.21545
475014,BURLINGTON HEALTH & REHAB,VT,0.18687,0.21545
075327,APPLE REHAB MYSTIC,CT,0.18871,0.21545
056192,HARBOR POST ACUTE CARE CENTER,CA,0.20112,0.21546
215336,HAGERSTOWN HEALTHCARE CENTER,MD,0.18733,0.21547
215031,AUTUMN LAKE HEALTHCARE AT LONG GREEN,MD,0.18456,0.21549
345317,CLAYTON REHABILITATION AND HEALTHCARE CENTER,NC,0.1826,0.2155
105560,"ST ANNES NURSING CENTER, ST ANNES RESIDENCE INC",FL,0.21525,0.21551
445187,AHC WEST TENNESSEE TRANSITIONAL CARE,TN,0.22021,0.21552
455908,SCHULENBURG REGENCY NURSING CENTER,TX,0.21887,0.21552
015408,"WALKER REHABILITATION CENTER, INC",AL,0.19847,0.21552
106131,SIERRA LAKES NURSING & REHABILITATION CENTER,FL,,0.21553
675563,COLONIAL NURSING & REHABILITATION CENTER,TX,0.2181,0.21554
106111,HEALTH CENTER AT SINAI RESIDENCES,FL,0.18667,0.21554
425084,MANNA POST ACUTE,SC,0.23256,0.21555
105423,"TERRACE OF JACKSONVILLE, THE",FL,0.20908,0.21555
415014,GRACE BARKER NURSING CENTER,RI,0.18227,0.21555
445253,RIVER GROVE HEALTH AND REHABILITATION,TN,0.19922,0.21557
145591,APERION CARE WESLEY,IL,0.19329,0.21558
345375,ACCORDIUS HEALTH AT SCOTLAND MANOR,NC,0.19391,0.21559
105697,EAST BAY REHABILITATION CENTER,FL,0.2216,0.21559
455910,CHANDLER NURSING CENTER,TX,0.21172,0.2156
495332,RIVERSIDE LIFELONG HEALTH & REHAB SMITHFIELD,VA,0.23732,0.21563
345294,AUTUMN CARE OF SHALLOTTE,NC,0.20356,0.21563
185210,THE WILLOWS AT HARRODSBURG,KY,0.16979,0.21563
065240,BRIGHTON CARE CENTER,CO,0.17701,0.21563
105640,NORTH LAKE CARE CENTER AND REHAB,FL,,0.21564
235725,AERIUS HEALTH CENTER,MI,0.19145,0.21565
395357,ELLEN MEMORIAL HEALTH CARE CENTER,PA,0.19846,0.21565
676194,MASON CREEK TRANSITIONAL CARE OF KATY,TX,0.19368,0.21566
675995,UNIVERSITY REHABILITATION CENTER,TX,0.23256,0.21566
285283,TABITHA NURSING CENTER AT CRETE,NE,0.19984,0.21566
195507,HERITAGE MANOR OF VILLE PLATTE,LA,0.23886,0.21568
366396,"LAURELS OF ATHENS, THE",OH,0.16965,0.21568
365441,LAKE POINTE REHABILITATION AND NURSING CENTER,OH,0.20444,0.2157
295071,TLC CARE CENTER,NV,0.21681,0.2157
335694,BROOKHAVEN HEALTH CARE FACILITY L L C,NY,0.21773,0.21571
185175,TREYTON OAK TOWERS,KY,0.19942,0.21571
676083,BROWNSVILLE NURSING AND REHABILITATION CENTER,TX,0.21056,0.21572
075320,ARK HEALTHCARE & REHABILITATION AT ST. CAMILLUS,CT,0.18756,0.21573
335797,THE OSBORN,NY,0.19372,0.21573
056378,OCEAN RIDGE POST ACUTE,CA,0.19953,0.21574
015450,WILLOWBROOKE CT SKILLED CARE CTR AT MAGNOLIA TRACE,AL,0.19505,0.21574
315219,"COMPLETE CARE AT VOORHEES, LLC",NJ,0.21581,0.21575
265636,NAZARETH LIVING CENTER,MO,0.17882,0.21575
215010,PINES NURSING AND REHAB,MD,0.16104,0.21575
515192,CABELL HEALTHCARE CENTER,WV,0.22449,0.21575
195326,NEW IBERIA MANOR SOUTH,LA,0.22032,0.21575
335634,GARDEN GATE HEALTH CARE FACILITY,NY,0.21794,0.21576
225691,LOOMIS LAKESIDE AT REEDS LANDING,MA,0.17406,0.21577
115132,ABERCORN REHABILITATION CENTER,GA,0.19784,0.21578
445240,LIFE CARE CENTER OF RED BANK,TN,0.18355,0.21578
105125,TERRACES OF LAKE WORTH CARE CENTER AND REHAB,FL,,0.21578
365422,BROOKHAVEN NURSING & REHABILITATION CENTER,OH,0.20146,0.21578
305060,BEDFORD HILLS CENTER,NH,0.19215,0.21579
035070,CASAS ADOBES POST ACUTE REHAB CENTER,AZ,0.19812,0.2158
366425,GREEN VILLAGE SKILLED NURSING & REHABILITATION LTD,OH,0.18196,0.21581
075138,BLOOMFIELD HEALTH CARE CENTER,CT,0.21565,0.21581
035105,SHEA POST ACUTE REHABILITATION CENTER,AZ,0.21736,0.21581
365615,AYDEN HEALTHCARE OF BELLE SPRINGS.,OH,0.2165,0.21582
676190,STILLHOUSE REHABILITATION AND HEALTHCARE CENTER,TX,0.18932,0.21582
495369,RIVERSIDE LIFELONG HEALTH & REHABILITATION PATRI,VA,0.1739,0.21583
395795,"LAFAYETTE MANOR, INC",PA,0.19327,0.21583
105119,WILTON MANORS HEALTHCARE & REHABILITATION CENTER,FL,0.19081,0.21585
495352,LEE HEALTH AND REHAB CENTER,VA,0.19095,0.21585
245435,KNUTE NELSON CARE CENTER,MN,0.18331,0.21586
035225,SUN CITY POST ACUTE,AZ,,0.21587
265693,"REHABILITATION CENTER OF INDEPENDENCE, THE",MO,0.19625,0.21588
335555,COLD SPRING HILLS CENTER FOR NURSING AND REHAB,NY,0.13836,0.21589
366368,OTTERBEIN SPRINGBORO,OH,0.19416,0.21589
365492,GRAND RIVER HEALTH & REHAB CENTER,OH,0.21479,0.2159
395536,EDISON MANOR NURSING & REHABILITATION CENTER,PA,0.18427,0.21591
055601,PARKVIEW JULIAN HEALTHCARE CENTER,CA,0.20913,0.21592
155667,OAK GROVE CHRISTIAN RETIREMENT VILLAGE,IN,0.16822,0.21594
555375,SUNSET VILLA POST ACUTE,CA,0.21293,0.21594
555403,MONTEREY PALMS HEALTH CARE CENTER,CA,0.19503,0.21594
145420,BRIDGEWAY SENIOR LIVING,IL,0.16188,0.21595
395182,ST JOHN NEUMANN CTR FOR REHAB & HEALTHCARE,PA,0.18596,0.21596
395732,HERITAGE CARE CENTER,PA,0.19974,0.21596
145652,VALLEY HI NURSING HOME,IL,0.21011,0.21598
146092,INTEGRITY HC OF HERRIN,IL,0.18576,0.21598
455493,VISTA HILLS HEALTH CARE CENTER,TX,0.1916,0.21598
345333,ABBOTTS CREEK CENTER,NC,0.19255,0.21599
145928,ARCADIA CARE JACKSONVILLE,IL,0.1919,0.21599
155527,PINEKNOLL REHABILITATION CENTRE,IN,0.18391,0.21599
335826,BUENA VIDA REHAB AND NURSING CENTER,NY,0.19229,0.216
035068,PUEBLO SPRINGS REHABILITATION CENTER,AZ,0.19707,0.216
425150,FRASER HEALTH CENTER,SC,0.18789,0.21602
155255,CELEBRATE SENIOR LIVING OF FORT WAYNE,IN,0.2247,0.21602
525370,TWIN PORTS HEALTH SERVICES,WI,0.19539,0.21602
525729,OAK PARK PLACE OF NAKOMA,WI,0.18335,0.21603
105120,SERENITY BAY NURSING AND REHABILITATION CENTER,FL,0.20861,0.21603
235592,HURON WOODS NURSING CENTER,MI,0.20154,0.21603
105462,CLEWISTON NURSING & REHABILITATION,FL,0.19453,0.21604
085047,GILPIN HALL,DE,0.20352,0.21604
045305,SOUTHERN TRACE REHABILITATION AND CARE CENTER,AR,0.18836,0.21605
035173,CHRISTIAN CARE NURSING CENTER,AZ,0.19115,0.21605
055525,CRENSHAW NURSING HOME,CA,0.22872,0.21607
495325,PHEASANT RIDGE NURSING & REHAB CENTER,VA,0.17826,0.21608
105803,"TERRACE OF HIALEAH, THE",FL,0.20935,0.21609
105497,VENICE HEALTH AND REHABILITATION CENTER,FL,0.15753,0.2161
265359,"LUTHERAN HOME, THE",MO,0.21494,0.2161
105930,VILLA HEALTHCARE & REHABILITATION CENTER,FL,0.21822,0.21611
245254,REGINA SENIOR LIVING,MN,0.19573,0.21612
676435,HOUSTON TRANSITIONAL CARE,TX,0.1855,0.21612
525522,MANOR OF FOND DU LAC,WI,0.22452,0.21613
445390,PICKETT CARE AND REHABILITATION CENTER,TN,0.18542,0.21615
055760,"ALHAMBRA HEALTHCARE & WELLNESS CENTRE, LP",CA,0.21771,0.21616
365585,EDGEWOOD MANOR OF LUCASVILLE I,OH,0.191,0.21616
235704,"WELLBRIDGE OF ROMEO, LLC",MI,0.19871,0.21617
495253,AUTUMN CARE OF NORFOLK,VA,0.18877,0.21618
035101,CHANDLER POST ACUTE AND REHABILITATION,AZ,0.18632,0.21619
165510,DAVENPORT LUTHERAN HOME,IA,0.18775,0.2162
395731,BETHEL PARK SKILLED NURSING AND REHABILITATION CTR,PA,0.20442,0.21621
075400,BETHEL HEALTH CARE CENTER,CT,0.24005,0.21622
395720,"HOMESTEAD VILLAGE, INC",PA,0.17383,0.21623
045220,FAYETTEVILLE HEALTH AND REHABILITATION CENTER,AR,0.19124,0.21623
396059,CONCORDIA AT THE CEDARS,PA,0.20078,0.21623
366241,STEUBENVILLE COUNTRY CLUB MANOR,OH,0.192,0.21623
515067,MOUNDSVILLE HEALTHCARE CENTER,WV,0.1901,0.21623
455864,LIFE CARE CENTER OF PLANO,TX,0.18937,0.21623
525643,PLEASANT VIEW NURSING HOME,WI,0.22254,0.21623
185225,ROSEDALE GREEN,KY,0.2093,0.21623
055776,WESTVIEW HEALTHCARE CENTER,CA,0.1448,0.21624
375494,WOODLANDS SKILLED NURSING AND THERAPY,OK,0.22289,0.21626
555027,BEACHSIDE NURSING CENTER,CA,0.21921,0.21626
365026,WEXNER HERITAGE HOUSE,OH,0.20206,0.21626
185300,SIGNATURE HEALTHCARE AT SUMMERFIELD REHAB & WELLNE,KY,0.1723,0.21626
265343,DELMAR GARDENS OF CREVE COEUR,MO,0.20868,0.21627
055104,SUNSET MANOR CONV HOSP,CA,0.22867,0.21627
235574,CASCADE SENIOR CARE CENTER,MI,0.18754,0.21627
265431,TRUMAN LAKE MANOR INC,MO,,0.21627
495425,THE REHAB CENTER AT BRISTOL,VA,0.20889,0.21627
056377,THE REHABILITATION CENTER ON PICO,CA,0.20067,0.21628
495392,"COLONIAL HEALTH & REHAB CENTER, LLC",VA,0.21003,0.21628
375531,UNIVERSITY VILLAGE RETIREMENT COMMUNITY,OK,0.219,0.21628
455628,HILLTOP VILLAGE NURSING AND REHABILITATION,TX,0.19351,0.21629
425091,MAGNOLIA MANOR - SPARTANBURG,SC,0.20183,0.21629
215236,FAIRFIELD NURSING & REHABILITATION CENTER,MD,0.22744,0.2163
145830,APERION CARE WEST CHICAGO,IL,0.1921,0.21631
265736,U-CITY FOREST MANOR,MO,,0.21631
075390,BEACON BROOK CENTER FOR HEALTH & REHABILITATION,CT,0.19981,0.21631
255093,THE PILLARS OF BILOXI,MS,0.25105,0.21633
255175,DIVERSICARE OF BROOKHAVEN,MS,0.21584,0.21633
215349,AUTUMN LAKE HEALTHCARE AT ARLINGTON WEST,MD,0.18281,0.21634
335829,ADIRA AT RIVERSIDE REHABILITATION AND NURSING,NY,0.23856,0.21636
145689,"PEARL OF ELK GROVE, THE",IL,0.16429,0.21637
225304,CHARLENE MANOR EXTENDED CARE FACILITY,MA,0.19042,0.21638
055402,WINDSOR EL CAMINO CARE CENTER,CA,0.20767,0.21639
365318,ST CATHERINES MANOR OF WASHINGTON COURT HOUSE,OH,0.20333,0.21639
075064,MILFORD HEALTH CARE CENTER INC,CT,0.17873,0.21641
675369,GRANDVIEW NURSING AND REHABILITATION CENTER,TX,0.18676,0.21642
345203,LIFE CARE CENTER OF BANNER ELK,NC,0.19002,0.21643
315176,MEDFORD CARE CENTER,NJ,0.21124,0.21643
445424,CENTER ON AGING AND HEALTH,TN,0.17348,0.21643
366155,NEW ALBANY CARE CENTER,OH,0.21238,0.21643
255325,WISTERIA GARDENS,MS,0.22677,0.21643
