PROVIDER_ID,PROVIDER_NAME,STATE,BASELINE_READMISSION_RATE,PERFORMANCE_READMISSION_RATE
335471,UTICA REHABILITATION & NURSING CENTER,NY,0.19373,0.18755
335573,LOCKPORT REHAB & HEALTH CARE CENTER,NY,0.17816,0.18755
365411,ANDOVER VILLAGE RETIREMENT COMMUNITY,OH,0.1825,0.18756
555805,BEL VISTA HEALTHCARE CENTER,CA,0.20646,0.18756
075353,MOZAIC SENIOR LIFE,CT,0.19679,0.18756
525543,MARQUARDT MEMORIAL MANOR,WI,0.17283,0.18756
505488,RICHMOND BEACH REHAB,WA,0.19376,0.18757
055817,MONTE VISTA HEALTHCARE CENTER,CA,0.19818,0.18757
255343,BEDFORD CARE CENTER OF PICAYUNE,MS,0.20921,0.18757
365317,SMITHVILLE WESTERN CARE CENTER,OH,0.18214,0.18757
445372,HARDIN COUNTY NH,TN,0.19567,0.18757
495385,"VMRC, COMPLETE LIVING CARE",VA,0.20879,0.18758
305067,MOUNT CARMEL REHABILITATION AND NURSING CENTER,NH,0.20087,0.18758
335678,ELDERWOOD AT LIVERPOOL,NY,0.20961,0.18759
055328,UNIVERSITY CARE CENTER,CA,0.20337,0.18759
065146,HAMPDEN HILLS POST ACUTE,CO,0.19137,0.18759
555545,THE COVE AT LA JOLLA,CA,0.19828,0.18759
265285,JEFFERSON CITY MANOR CARE CENTER,MO,0.21613,0.18759
335070,BROOKLYN GARDENS NURSING & REHABILITATION CENTER,NY,0.1751,0.1876
395309,YORK SOUTH SKILLED NURSING AND REHABILITATION CTR,PA,0.16366,0.18761
105413,ASPIRE AT BROOKSVILLE,FL,0.20621,0.18761
495214,AUGUSTA MEDICAL CTR SKILLED CA,VA,0.21474,0.18762
115099,NEW HORIZONS HABERSHAM,GA,0.20313,0.18762
445245,FOOTHILLS TRANSITIONAL CARE AND REHABILITATION,TN,0.19791,0.18762
335557,REBEKAH REHAB AND EXTENDED CARE CENTER,NY,0.1753,0.18762
075286,CIVITA CARE CENTER AT NEWINGTON,CT,0.20348,0.18764
555572,GROSSMONT HOSPITAL D/P SNF,CA,0.17788,0.18765
235395,OPTALIS HEALTH AND REHABILITATION OF THREE RIVERS,MI,0.17327,0.18767
525512,SKAALEN NURSING AND REHABILITATION CENTER,WI,0.18096,0.18767
555855,BAYWOOD COURT HEALTH CENTER,CA,0.17244,0.18767
075144,APPLE REHAB GUILFORD,CT,0.19487,0.18769
335353,HERITAGE VILLAGE REHAB AND SKILLED NURSING INC.,NY,0.19588,0.1877
065265,BERTHOUD CARE AND REHABILITATION,CO,,0.18771
235602,HAZEL I FINDLAY COUNTRY MANOR,MI,0.17677,0.18771
445189,KIRBY PINES MANOR,TN,0.18437,0.18771
165287,CRESTVIEW SPECIALTY CARE,IA,0.19697,0.18773
315092,CAREONE AT HOLMDEL,NJ,0.15423,0.18773
105550,BROOKWOOD GARDENS REHABILITATION AND NURSING CENTE,FL,0.19666,0.18773
075263,AUTUMN LAKE HEALTHCARE AT CROMWELL,CT,0.19208,0.18774
075246,WHITNEY REHABILITATION CARE CENTER,CT,0.17916,0.18775
525459,FRIENDLY VILLAGE NURSING AND REHAB CENTER,WI,0.17536,0.18775
676478,HARBOR VALLEY HEALTH AND REHABILITATION,TX,,0.18775
195593,LAGNIAPPE HEALTHCARE,LA,0.19089,0.18776
105549,ASPIRE AT THE HARBOR,FL,0.2034,0.18777
155378,SIGNATURE HEALTHCARE AT PARKWOOD,IN,0.18141,0.18777
265312,GAINESVILLE NURSING,MO,0.19829,0.18778
115665,COASTAL MANOR,GA,0.17847,0.18778
335541,MASONIC CARE COMMUNITY OF NEW YORK,NY,0.17671,0.18778
366244,CONTINUING HEALTHCARE AT WILLOW HAVEN,OH,0.20549,0.1878
385253,BEND TRANSITIONAL CARE,OR,0.19826,0.18781
345015,CLAPP'S CONVALESCENT NURSING HOME INC,NC,0.19495,0.18781
035117,PAYSON CARE CENTER,AZ,0.19678,0.18782
165269,CLEARVIEW HOME,IA,,0.18782
375451,PLEASANT VALLEY HEALTH CARE CENTER,OK,0.19228,0.18782
255185,INDIANOLA REHABILITATION AND HEALTHCARE CENTER,MS,0.1926,0.18782
555872,CHAPARRAL HOUSE,CA,0.17203,0.18785
676046,CARE NURSING & REHABILITATION,TX,0.18884,0.18785
305045,PLEASANT VIEW CENTER,NH,0.18547,0.18785
145619,ALLURE OF LAKE STOREY,IL,0.19918,0.18786
335438,MEADOWBROOK HEALTHCARE,NY,0.18335,0.18786
245563,GREEN PINE ACRES NURSING HOME,MN,0.19116,0.18786
285144,THE PINES AT BLUE HILL,NE,0.21451,0.18789
055685,BRIGHTON PLACE SPRING VALLEY,CA,0.18338,0.18789
115593,BAYVIEW NURSING HOME,GA,0.18484,0.18789
235320,LAHSER HILLS CARE CENTRE,MI,0.22042,0.18789
445304,WYNDRIDGE HEALTH AND REHAB CTR,TN,0.20329,0.18789
335284,CENTRAL ISLAND HEALTHCARE,NY,0.17887,0.1879
365147,HIGHLAND OAKS HEALTH CENTER,OH,0.18789,0.1879
155062,BRICKYARD HEALTHCARE - LAPORTE CARE CENTER,IN,0.21448,0.1879
195425,PATTERSON HEALTHCARE CENTER,LA,0.21018,0.18791
056043,COLONIAL CARE CENTER,CA,0.16502,0.18791
366423,MEADOWS OF OTTAWA THE,OH,0.20193,0.18792
315464,CAREONE AT EVESHAM,NJ,0.19735,0.18792
195564,ACADIA ST LANDRY NURSING & REHABILITATION CENTER,LA,0.22383,0.18792
225722,CARDIGAN NURSING & REHABILITATION CENTER,MA,,0.18793
235633,BEACON HILL AT EASTGATE,MI,0.20715,0.18793
235535,RIVERSIDE NURSING CENTRE,MI,0.20467,0.18794
335565,THE GRAND REHABILITATION AND NURSING AT BARNWELL,NY,0.19218,0.18794
395292,WESBURY UNITED METHODIST COMMU,PA,0.19407,0.18794
315135,CREST POINTE REHABILITATION AND HEALTHCARE CENTER,NJ,0.20132,0.18795
676419,LA HACIENDA DE PAZ REHABILITATION AND CARE CENTER,TX,0.20336,0.18795
045416,TIMBERLANE HEALTH & REHABILITATION,AR,0.19029,0.18795
366394,"AVENUE CARE AND REHABILITATION CENTER, THE",OH,0.18632,0.18796
195426,THE ENCORE HEALTHCARE AND REHABILITATION CENTER,LA,0.18153,0.18796
345483,SHAIRE NURSING CENTER,NC,0.16406,0.18796
175410,"CATHOLIC CARE CENTER, INC",KS,0.19537,0.18798
365446,THE PAVILION AT PIKETON,OH,0.20762,0.18798
395226,SPRUCE MANOR NURSING & REHABILITATION CENTER,PA,0.19288,0.18799
155205,GREENCROFT HEALTHCARE,IN,0.17611,0.18799
285036,EASTMONT,NE,0.20202,0.18799
235201,MUNSON HEALTHCARE CRAWFORD CONTINUING CARE CENTER,MI,0.17411,0.188
305044,GOLDEN VIEW HEALTH CARE CENTER,NH,0.1587,0.188
065341,CASEY'S POND SENIOR LIVING,CO,0.17902,0.188
185468,LANDMARK OF RIVER CITY REHABILITATION AND NURSING,KY,0.19881,0.18801
465171,LEGACY VILLAGE REHABILITATION,UT,0.16385,0.18802
106058,WOODLAND GROVE HEALTHCARE & REHABILITATION CENTER,FL,0.20215,0.18802
395818,MASONIC VILLAGE AT LAFAYETTE HILL,PA,,0.18803
065153,VISTA GRANDE REHABILITATION AND HEALTHCARE CENTER,CO,0.17841,0.18804
555444,SUNNYVALE GARDENS POST ACUTE,CA,0.22294,0.18805
335569,ELDERWOOD OF LAKESIDE AT BROCKPORT,NY,0.17788,0.18805
335588,THE GRAND REHABILITATION AND NRSG AT CHITTENANGO,NY,0.18242,0.18806
055042,ALTA VISTA HEALTHCARE & WELLNESS CENTRE,CA,0.20505,0.18806
165072,GOOD SHEPHERD HEALTH CENTER,IA,0.18913,0.18806
675494,LONE STAR RANCH REHABILITATION AND HEALTHCARE CENT,TX,0.20506,0.18807
165361,ROLLING GREEN VILLAGE CARE CEN,IA,0.19409,0.18808
345053,PETTIGREW REHABILITATION CENTER,NC,0.17851,0.18808
235028,HURON CO MED CARE FACILITY,MI,0.18499,0.18809
555700,BEVERLY HILLS REHABILITATION CENTRE,CA,0.2109,0.1881
335726,BEACON REHABILITATION AND NURSING CENTER,NY,0.18767,0.1881
445397,ADAMSVILLE HEALTHCARE AND REHABILITATION CENTER,TN,0.20295,0.1881
165436,IVY AT DAVENPORT,IA,0.19772,0.1881
465175,MISSION AT COMMUNITY LIVING REHABILITATION CENTER,UT,0.18778,0.18811
335482,ELDERWOOD AT TICONDEROGA,NY,0.19196,0.18811
215197,FOX CHASE HEALTHCARE,MD,0.20388,0.18812
525482,BURLINGTON HEALTH AND REHABILITATION CENTER,WI,0.18989,0.18812
335819,PARK AVENUE EXTENDED CARE FACILITY,NY,0.1671,0.18812
366305,KINGSTON CARE CENTER OF SYLVANIA,OH,0.16234,0.18813
235008,MAPLE LAWN MEDICAL CARE FACILI,MI,0.15295,0.18814
675915,PARK PLACE CARE CENTER,TX,0.17949,0.18814
225615,RIVERBEND OF SOUTH NATICK,MA,0.18196,0.18814
205004,HIBBARD SKILLED NURSING & REHABILITATION CENTER,ME,0.1963,0.18815
145735,BRIA OF RIVER OAKS,IL,0.18979,0.18815
315405,SHADY LANE GLOUCESTER CO HOME,NJ,0.18521,0.18816
105612,SILVERCREST HEALTH AND REHABILITATION CENTER,FL,0.20365,0.18816
135130,ASPEN TRANSITIONAL REHABILITATION,ID,0.15693,0.18816
115277,FLORENCE HAND HOME,GA,0.17751,0.18817
065318,IRONDALE POST ACUTE,CO,,0.18817
395786,PLEASANT VIEW COMMUNITIES,PA,0.19621,0.18818
235286,MEDILODGE OF CASS CITY,MI,0.22394,0.18819
385049,COLUMBIA BASIN CARE FACILITY,OR,0.18126,0.18821
265798,COMMUNITY MANOR,MO,0.19182,0.18822
275056,ELKHORN HEALTHCARE AND REHABILITATION,MT,0.17925,0.18822
305069,SAINT ANN REHABILITATION AND NURSING CENTER,NH,0.16162,0.18823
345318,BRUNSWICK COVE NURSING CENTER,NC,0.1833,0.18823
065110,RED CLIFFS POST ACUTE,CO,0.18298,0.18823
555362,CASA DE LAS CAMPANAS,CA,0.21401,0.18824
395784,"CHURCH OF GOD HOME, INC",PA,0.17915,0.18824
525365,PINE VALLEY COMMUNITY VILLAGE,WI,0.19519,0.18824
145946,"PEARL OF HILLSIDE,THE",IL,0.2061,0.18824
555524,HEALTH CARE CTR AT THE FORUM AT RANCHO SAN ANTONIO,CA,0.1649,0.18824
185394,ST ELIZABETH EDGEWOOD SNF,KY,0.20809,0.18825
055173,FOLSOM CARE CENTER,CA,0.1827,0.18825
675729,STONECREEK NURSING & REHABILITATION,TX,0.18793,0.18826
225774,NEWBRIDGE ON THE CHARLES SKILLED NURSING FACILITY,MA,0.20838,0.18826
106066,OAK HAMMOCK AT THE UNIVERSITY OF FLORIDA INC,FL,0.19062,0.18827
115537,SPALDING POST ACUTE LLC,GA,0.20249,0.18827
105710,JACKSONVILLE NURSING AND REHAB CENTER,FL,0.21156,0.18827
676465,LAS ALTURAS NURSING & TRANSITIONAL CARE,TX,0.18409,0.18829
676170,ST DOMINIC VILLAGE NURSING HOME,TX,0.20123,0.18829
325133,"WELBROOK SENIOR LIVING, LLC",NM,,0.18831
385091,HEARTHSTONE NURSING & REHABILITATION CENTER,OR,0.19481,0.18832
375384,NEW HOPE RETIREMENT & CARE CENTER,OK,0.20067,0.18833
215231,CLINTON HEALTHCARE  CENTER,MD,0.18315,0.18833
495302,FOREST HEALTH & REHAB CENTER,VA,0.18495,0.18833
155006,WATERS OF WABASH SKILLED NURSING FACILITY EAST THE,IN,0.21677,0.18833
106114,BUFFALO CROSSINGS HEALTHCARE & REHABILITATION CEN,FL,0.15733,0.18833
105966,LARSEN HEALTH CENTER,FL,0.17435,0.18833
495420,ALBEMARLE HEALTH & REHABILITATION CENTER,VA,0.19959,0.18834
165471,STONEHILL CARE CENTER,IA,0.1974,0.18834
155812,WELLBROOKE OF CRAWFORDSVILLE,IN,0.17249,0.18835
235072,OAKVIEW MEDICAL CARE FACILITY,MI,0.18124,0.18836
315370,CARNEGIE POST ACUTE CARE AT PRINCETON LLC,NJ,0.18617,0.18836
265193,WESTWOOD HILLS HEALTH & REHABILITATION CENTER,MO,0.20213,0.18837
175560,COLONIAL VILLAGE,KS,0.19334,0.18837
056457,GREENRIDGE POST ACUTE,CA,0.18486,0.18837
395704,"LAFAYETTE-REDEEMER, THE",PA,0.2003,0.18838
185336,SPRINGFIELD NURSING AND REHABILITATION CENTER,KY,0.20265,0.18838
155635,GRACE VILLAGE HEALTH CARE FACILITY,IN,0.18981,0.18838
435046,GOOD SAMARITAN SOCIETY SIOUX FALLS CENTER,SD,0.19842,0.18839
115040,"CENTER FOR ADVANCED REHAB AT PARKSIDE, THE",GA,0.17709,0.18839
555106,SANTA FE LODGE,CA,0.20103,0.18839
415074,VILLAGE HOUSE NURSING & REHABILITATION CENTER,RI,0.21547,0.1884
515117,HILLCREST HEALTHCARE CENTER,WV,0.23272,0.18842
215149,DENTON NURSING AND REHAB,MD,0.1671,0.18843
056244,GRAND PARK CONVALESCENT HOSPITAL,CA,0.1581,0.18843
676469,THE PREMIER SNF OF ALICE,TX,,0.18844
145658,APERION CARE PLUM GROVE,IL,,0.18845
055653,SOUTH COAST POST ACUTE,CA,0.18383,0.18845
395875,GREENWOOD CENTER FOR NURSING AND REHAB,PA,0.19181,0.18846
105607,PALM GARDEN OF WEST PALM BEACH,FL,0.23147,0.18847
335848,KENDAL ON HUDSON,NY,0.21545,0.18847
075407,AUTUMN LAKE HEALTHCARE AT WEST HARTFORD,CT,0.21074,0.18848
335019,REGEIS CARE CENTER,NY,0.19092,0.18848
295075,PAHRUMP HEALTH AND REHABILITATION CENTER,NV,0.19655,0.18849
165350,PINE ACRES REHABILITATION AND CARE CENTER,IA,0.17749,0.18849
315487,PREFERRED CARE AT MERCER,NJ,0.16851,0.18849
235209,MEDILODGE OF LEELANAU,MI,0.22773,0.18849
395363,KINZUA HEALTHCARE AND REHABILITATION CENTER,PA,0.18756,0.18849
265787,LAVERNA MANOR HEALTH & REHABILITATION,MO,0.19043,0.1885
555023,CASA DORINDA,CA,0.18497,0.18851
415079,TRINITY HEALTH AND REHABILITATION CENTER,RI,0.19257,0.18851
245368,GRAND VILLAGE,MN,0.18378,0.18852
115146,ORCHARD VIEW REHABILITATION & SKILLED NURSING CTR,GA,0.2241,0.18853
395105,MOSSER NURSING HOME,PA,0.18573,0.18853
155448,LOWELL HEALTHCARE,IN,0.18728,0.18855
515071,SALEM CENTER,WV,0.19215,0.18856
215313,AUTUMN LAKE HEALTHCARE AT GLADE VALLEY,MD,0.15727,0.18856
215246,BEDFORD COURT HEALTHCARE CENT.,MD,0.21096,0.18856
245234,GOOD SAMARITAN SOCIETY - WACONIA AND WESTVIEW ACRE,MN,0.21752,0.18856
505534,TRANSITIONAL CARE CENTER OF SEATTLE,WA,,0.18857
676410,PURE HEALTH TRANSITIONAL CARE AT TEXAS HEALTH PRES,TX,0.19544,0.18857
425400,PRUITTHEALTH- BLYTHEWOOD,SC,0.15705,0.18857
365508,WELCOME NURSING HOME,OH,0.18979,0.18857
045270,ARBOR OAKS HEALTHCARE AND REHABILITATION CENTER,AR,0.24506,0.18858
195324,FAIR CITY HEALTH AND REHAB,LA,0.175,0.18858
035169,DESERT HIGHLANDS CARE CENTER,AZ,0.16081,0.1886
106133,NORTH DADE NURSING AND REHABILITATION CENTER,FL,,0.18861
345302,VERO HEALTH & REHAB OF SYLVA,NC,0.20259,0.18861
365589,HICKORY CREEK OF ATHENS,OH,0.21765,0.18862
145404,FARMINGTON VILLAGE NRSG,IL,0.21016,0.18862
366128,ALTERCARE CAMBRIDGE INC.,OH,0.26003,0.18863
105507,ASPIRE AT NORTH FORT MYERS,FL,0.17137,0.18864
345449,UNIVERSAL HEALTH CARE/KING,NC,0.20433,0.18866
555127,HILLCREST POST ACUTE,CA,0.17026,0.18867
475055,THE VILLA REHAB,VT,0.18663,0.18867
225038,LIFE CARE CENTER OF LEOMINSTER,MA,0.15878,0.18868
345565,TRINITY ELMS,NC,0.21975,0.18868
395442,YORK NORTH SKILLED NURSING AND REHABILITATION CTR,PA,0.16346,0.18868
345036,ELIZABETH CITY HEALTH AND REHABILITATION,NC,0.21004,0.1887
335162,THE GRAND REHABILITATION AND NURSING AT SOUTH POIN,NY,0.18855,0.18871
495318,BERRY HILL NURSING HOME,VA,0.19958,0.18871
085050,CADIA REHABILITATION BROADMEADOW,DE,0.1908,0.18871
305057,COURVILLE AT MANCHESTER,NH,0.19524,0.18872
165455,ACCURA HEALTHCARE OF CARROLL,IA,0.20577,0.18873
075321,"ST JOSEPH'S LIVING CENTER, INC",CT,0.17629,0.18873
165555,ADEL ACRES,IA,0.21754,0.18873
375324,CHEROKEE COUNTY NURSING CENTER,OK,0.15907,0.18873
285130,BEATRICE HEALTH AND REHABILITATION,NE,0.19543,0.18874
285133,HILLCREST HEALTH & REHAB,NE,0.22544,0.18874
676493,SUN VALLEY REHABILITATION AND HEALTHCARE CENTER,TX,,0.18874
335263,CHURCH HOME OF THE PROTESTANT EPISCOPAL CHURCH,NY,0.18193,0.18875
075301,CALEB HITCHCOCK HEALTH CENTER,CT,0.16178,0.18876
045337,HEATHER MANOR NURSING AND REHABILITATION CENTER,AR,0.22152,0.18876
175322,GOOD SAMARITAN SOCIETY - HAYS,KS,0.21103,0.18876
335655,MIDDLETOWN PARK REHAB & HEALTH CARE CENTER,NY,0.23788,0.18877
525351,VILLA PINES LIVING CENTER,WI,0.18424,0.18878
035134,RIM COUNTRY HEALTH & RETIREMENT COMMUNITY,AZ,0.19028,0.18878
105743,FLEET LANDING,FL,0.19303,0.18878
145828,KENWOOD VLGE NRSG AND RHB CTR,IL,0.20082,0.18879
155481,ARBOR TRACE HEALTH & LIVING COMMUNITY,IN,0.18527,0.1888
105001,BEDROCK REHABILITATION AND NURSING CENTER AT LAKE,FL,0.18274,0.1888
366334,"BETHANY NURSING HOME, INC",OH,0.16587,0.18881
515104,"MADISON, THE",WV,0.2034,0.18882
335516,THE PHOENIX REHABILITATION AND NURSING CENTER,NY,0.17609,0.18882
335279,MAYFAIR CARE CENTER,NY,0.19748,0.18882
445478,DURHAM-HENSLEY HEALTH AND REHABILITATION,TN,0.211,0.18883
175181,LARKSFIELD PLACE,KS,0.18299,0.18883
075237,COMPLETE CARE AT KIMBERLY HALL-SOUTH,CT,0.17938,0.18883
035094,HAVEN OF SEDONA,AZ,0.2032,0.18883
045192,THE SPRINGS OF MT VISTA,AR,0.17447,0.18884
445454,AHC HUMBOLDT,TN,0.2159,0.18884
395180,CORNWALL MANOR,PA,0.18441,0.18885
135139,SUNTERRA SPRINGS RIVERVIEW,ID,0.19771,0.18885
335820,REGAL HEIGHTS REHABILITATION AND HEALTH CARE CTR,NY,0.20204,0.18885
375144,COTTONWOOD CREEK SKILLED NURSING & THERAPY,OK,0.19948,0.18885
265105,DELMAR GARDENS WEST,MO,0.19726,0.18886
335839,AFFINITY SKILLED LIVING AND REHABILITATION CENTER,NY,0.232,0.18886
335802,GLEN ARDEN INC,NY,0.19919,0.18886
345555,HILLCREST RALEIGH AT CRABTREE VALLEY,NC,0.19952,0.18887
395826,NORTH HILLS SKILLED NURSING AND REHABILITATION CTR,PA,0.20682,0.18887
465139,LIFE CARE CENTER OF SALT LAKE CITY,UT,0.19202,0.18887
396114,TWIN PINES HEALTH CARE CENTER,PA,0.18515,0.18889
445203,WEST MEADE PLACE,TN,0.18276,0.18889
175448,ABERDEEN VILLAGE,KS,0.23137,0.18889
395845,CRANBERRY PLACE,PA,0.17951,0.18889
165279,MONTICELLO NURSING & REHAB CEN,IA,0.20801,0.18891
265694,SALT RIVER COMMUNITY CARE,MO,0.20612,0.18892
075293,JEFFERSON HOUSE,CT,0.17907,0.18892
245212,ESSENTIA HEALTH OAK CROSSING,MN,0.21708,0.18892
495226,WAYLAND NURSING AND REHABILITATION CENTER,VA,0.21312,0.18893
055626,HEALTHCARE CENTRE OF FRESNO,CA,0.17902,0.18894
035114,MOUNTAIN VIEW MANOR,AZ,,0.18894
145536,"CITADEL OF BOURBONNAIS,THE",IL,0.2283,0.18894
105861,NURSING & REHABILITATION CENTER OF MELBOURNE,FL,0.19872,0.18895
035166,ESTRELLA HEALTH AND REHABILITATION CENTER,AZ,0.18286,0.18895
045256,SHERIDAN HEALTHCARE AND REHABILITATION CENTER,AR,0.19687,0.18895
465153,STONEHENGE OF CEDAR CITY,UT,0.1783,0.18895
345293,RICHMOND PINES HEALTHCARE AND REHABILITATION CENTE,NC,0.19686,0.18896
335396,MONTGOMERY NURSING AND REHABILITATION CENTER,NY,0.20119,0.18896
335828,TACONIC REHABILITATION AND NURSING AT BEACON,NY,0.18715,0.18897
015042,"SUMTER HEALTH AND REHABILITATION, L L C",AL,0.20901,0.18897
155321,"WATERS OF FORT WAYNE SKILLED NURSING FACILITY, THE",IN,,0.18897
445516,CREEKSIDE CENTER FOR REHABILITATION AND HEALING,TN,0.18906,0.18898
395899,"GARDENS AT ORANGEVILLE, THE",PA,0.17989,0.18898
335228,BRIDGEWATER CENTER FOR REHAB & NURSING L L C,NY,0.19553,0.18898
115587,BUCHANAN HEALTHCARE CENTER,GA,0.20668,0.18898
465090,CASCADES AT ORCHARD PARK,UT,0.18428,0.18898
015115,"CORDOVA HEALTH AND REHABILITATION, LLC",AL,0.19794,0.18898
056207,PACIFIC GARDENS NURSING AND REHABILITATION CENTER,CA,0.17751,0.189
185318,"LANDMARK OF KUTTAWA, A REHABILITATION & NURSING CE",KY,0.18501,0.18901
555116,ROSEWOOD HEALTH FACILITY,CA,0.18801,0.18901
455497,CREEKSIDE TERRACE REHABILITATION,TX,0.17149,0.18901
075231,APPLE REHAB COLCHESTER,CT,0.18726,0.18902
366462,CANAL WINCHESTER CARE CENTER,OH,0.19751,0.18902
235700,THE WILLOWS AT EAST LANSING,MI,0.2226,0.18902
145151,ALLURE OF MENDOTA,IL,0.18424,0.18903
035189,LA CANADA CARE CENTER,AZ,0.21318,0.18905
395319,MANATAWNY CENTER FOR REHABILITATION AND NURSING,PA,0.18957,0.18905
255072,WINSTON COUNTY NURSING HOME,MS,0.20829,0.18905
255290,DRIFTWOOD NURSING CENTER,MS,0.20949,0.18906
055833,"FULTON GARDENS POST ACUTE, LLC",CA,0.17935,0.18906
366013,LEXINGTON COURT CARE CENTER,OH,0.20158,0.18907
075388,APPLE REHAB AVON,CT,0.20096,0.18908
145026,WESTMINSTER PLACE,IL,0.17083,0.18908
035099,SANDSTONE OF TUCSON REHAB CENTRE,AZ,0.17077,0.18908
056125,ALAMITOS BELMONT HEALTH AND REHABILITATION,CA,0.20689,0.18909
676094,FOCUSED CARE AT ORANGE,TX,0.1916,0.18909
675452,ROSEWOOD REHABILITATION AND CARE CENTER,TX,0.22667,0.18909
435054,AVANTARA REDFIELD,SD,0.19832,0.18909
146003,"LOFT REHAB OF ROCK SPRINGS, THE",IL,0.18603,0.18909
676341,CAPROCK NURSING & REHABILITATION,TX,0.21007,0.1891
445259,SUMMIT VIEW OF ROCKY TOP,TN,,0.1891
225494,SUNNY ACRES SKILLED NURSING AND REHABILITATION CTR,MA,0.20869,0.1891
165501,COMMUNITY CARE CENTER,IA,0.18088,0.18911
366196,ALTERCARE NEWARK SOUTH INC.,OH,0.20377,0.18912
015195,VILLAGE AT COOK SPRINGS SKILLED NURSING FACILITY,AL,0.20314,0.18912
146114,LENA LIVING CENTER,IL,0.20838,0.18912
305063,PRESIDENTIAL OAKS,NH,0.2027,0.18912
366044,GARDENS OF PAULDING THE,OH,0.21788,0.18913
425063,NHC HEALTHCARE - GREENWOOD,SC,0.18251,0.18913
115545,JONESBORO NURSING AND REHABILITATION CENTER,GA,0.20677,0.18913
215005,COMPLETE CARE AT ANNAPOLIS,MD,0.21522,0.18914
515025,ELKINS REHABILITATION & CARE CENTER,WV,0.20147,0.18914
525270,CROSSROADS CARE CENTER OF FOND DU LAC,WI,0.21767,0.18915
105721,CEDAR HILL NURSING AND REHAB CENTER,FL,0.18023,0.18915
366413,OAKS AT BETHESDA THE,OH,0.21133,0.18915
395848,BARCLAY FRIENDS,PA,0.22167,0.18916
675415,WINDSOR LAS PALMAS NURSING AND REHABILITATION CENT,TX,0.21007,0.18917
145483,MONTGOMERY NURSING & REHAB CTR,IL,0.17854,0.18917
235252,LOURDES REHABILITATION AND HEALTHCARE CENTER,MI,0.2226,0.18917
155689,MAJESTIC CARE OF GOSHEN,IN,0.17507,0.18918
055885,WINDSOR COUNTRY DRIVE CARE CENTER,CA,0.22766,0.1892
395518,COURTYARD GARDENS NURSING AND REHAB CTR,PA,0.19238,0.1892
055826,VALLEY OAKS POST ACUTE,CA,0.16956,0.1892
185012,HILLSIDE NURSING AND REHABILITATION CENTER,KY,0.19932,0.18922
265634,LACOBA HOMES INC,MO,0.18917,0.18923
465123,LOGAN REGIONAL HOSPITAL TRANSITIONAL CARE UNIT,UT,0.21368,0.18923
015434,LYNWOOD REHABILITATION AND HEALTHCARE CENTER,AL,0.20029,0.18923
035144,PEORIA POST ACUTE AND REHABILITATION,AZ,0.21781,0.18924
305056,MERRIMACK COUNTY NURSING HOME,NH,0.20632,0.18924
425110,OAK HARBOR HEALTHCARE,SC,0.17748,0.18924
335015,SCHERVIER NURSING CARE CENTER,NY,0.18384,0.18925
525656,FOUR WINDS MANOR,WI,0.20581,0.18925
375098,EMERALD CARE CENTER MIDWEST,OK,0.15906,0.18925
676220,GRANITE MESA HEALTH CENTER,TX,0.18292,0.18926
165599,CEDAR MANOR NURSING HOME,IA,0.20231,0.18926
345143,SILER CITY CENTER,NC,0.18162,0.18927
155769,MORRISON WOODS HEALTH CAMPUS,IN,0.16429,0.18927
335072,ST JOSEPH'S HOSPITAL - SKILLED NURSING FACILITY,NY,0.2026,0.18928
115262,APPLING NURSING AND REHABILITATION PAVILION,GA,,0.18928
676392,LEGEND OAKS HEALTHCARE AND REHABILITATION - NEW BR,TX,0.24374,0.18928
525475,RIVER'S BEND HEALTH SERVICES,WI,0.17331,0.18929
055656,RIVERSIDE POINT HEALTHCARE & WELLNESS CENTRE,CA,0.20972,0.1893
395352,BROAD ACRES HEALTH AND REHABILITATION,PA,0.1964,0.1893
335346,ELDERWOOD AT WAVERLY,NY,0.19641,0.18932
175182,DELMAR GARDENS OF OVERLAND PARK,KS,0.22031,0.18932
235267,OPTALIS HEALTH AND REHABILITATION OF KINGSFORD,MI,0.16824,0.18933
505485,LINDEN GROVE HEALTH CARE CENTER,WA,0.19922,0.18933
335256,THE PINES AT CATSKILL CENTER FOR NURSING & REHAB,NY,0.17849,0.18933
425118,BENNETTSVILLE HEALTH AND REHABILITATION CENTER,SC,0.21618,0.18933
215283,TRANSITIONAL CARE SERVICES AT MERCY MEDICAL CENTER,MD,0.18186,0.18934
375320,RAINBOW HEALTH CARE COMMUNITY AND RAINBOW ASSISTED,OK,0.2034,0.18934
115775,PRESBYTERIAN VILLAGE - ATHENS,GA,,0.18935
015182,"GEORGIANA HEALTH AND REHABILITATION, LLC",AL,0.16805,0.18936
676201,TUSCANY VILLAGE,TX,0.18774,0.18936
245381,HARMONY GARDENS,MN,,0.18936
145384,EDEN VILLAGE CARE CENTER,IL,0.19576,0.18936
145454,CARLINVILLE REHAB & HCC,IL,0.19885,0.18937
676208,EAGLE CREST RAPID RECOVERY,TX,0.20517,0.18937
035111,LAKE PLEASANT POST ACUTE REHABILITATION CENTER,AZ,0.23302,0.18937
105757,WESTMINSTER TOWERS,FL,0.23085,0.18938
105516,DARCY HALL OF LIFE CARE,FL,0.22993,0.18938
366189,VANCREST OF DELPHOS,OH,0.16778,0.18939
365998,HOLZER SENIOR CARE CENTER,OH,0.18205,0.1894
675797,WESTON INN NUSRING AND REHABILITATION,TX,0.19631,0.1894
555438,KEI-AI LOS ANGELES HEALTHCARE CENTER,CA,0.18757,0.1894
555659,SAN DIEGO POST-ACUTE CENTER,CA,0.19338,0.18941
135103,PRESTIGE CARE & REHABILITATION - THE ORCHARDS,ID,0.19673,0.18941
495426,MULBERRY CREEK NURSING & REHAB CENTER,VA,,0.18942
335280,TROY CENTER FOR REHABILITATION AND NURSING,NY,0.18273,0.18942
245184,ROCHESTER EAST HEALTH SERVICES,MN,0.21209,0.18943
425385,WILDEWOOD DOWNS,SC,0.17923,0.18943
235289,VILLA AT BORGESS PLACE,MI,0.17555,0.18943
335446,CYPRESS GARDEN CENTER FOR NURSING AND REHAB,NY,0.19419,0.18944
105451,PENINSULA REHABILITATION AND NURSING CENTER,FL,0.17016,0.18944
085028,WILMINGTON NURSING  & REHABILITATION CENTER,DE,0.19379,0.18944
366441,SEVEN HILLS HEALTH & REHAB CENTER,OH,0.21359,0.18945
285062,MIDWEST COVENANT HOME,NE,,0.18946
335739,LUXOR NURSING AND REHABILITATION AT MILLS POND,NY,0.15793,0.18946
335532,AARON MANOR REHABILITATION AND NURSING CENTER,NY,0.20438,0.18947
065269,LIFE CARE CENTER OF PUEBLO,CO,0.19384,0.18948
425075,LILA DOYLE POST ACUTE,SC,0.17755,0.18948
015063,DIVERSICARE OF BOAZ,AL,0.19076,0.1895
395477,LAURELDALE SKILLED NURSING AND REHABILITATION CENT,PA,0.17389,0.1895
345004,PERSON MEMORIAL HOSPITAL,NC,0.18835,0.1895
396102,CONEMAUGH MEMORIAL MEDICAL CENTER TCU,PA,0.2089,0.18951
155631,WHITE RIVER LODGE,IN,0.17492,0.18951
145522,BEACON HILL,IL,0.18087,0.18951
495177,COMMUNITY MEMORIAL HOSPITAL HUNDLEY CENTER,VA,0.2036,0.18952
365466,THE LAURELS OF HEATH,OH,0.21095,0.18952
345241,EDEN REHABILITATION AND HEALTHCARE CENTER,NC,0.21308,0.18952
045306,THE SPRINGS OF HILLCREST,AR,,0.18952
325123,FIESTA PARK WELLNESS & REHABILITATION,NM,0.20157,0.18952
085020,PINNACLE REHABILITATION & HEALTH CENTER,DE,0.19354,0.18952
165623,CREEKSIDE,IA,,0.18953
155001,HOOVERWOOD,IN,0.22196,0.18953
395613,LAUREL LAKES REHABILITATION AND WELLNESS CENTER,PA,0.19383,0.18953
315439,UNITED METHODIST COMMUNITIES AT BRISTOL GLEN,NJ,0.21008,0.18953
315244,PREFERRED CARE AT ABSECON,NJ,0.18221,0.18953
366485,BRIARFIELD PLACE,OH,,0.18953
335398,SANS SOUCI REHABILITATION AND NURSING CENTER,NY,0.20781,0.18953
105751,SPECIALTY HEALTH AND REHABILITATION CENTER,FL,0.19062,0.18954
245114,HARMONY RIVER LIVING CENTER,MN,0.20456,0.18954
245170,FAIRVIEW UNIVERSITY TRANS SERV,MN,0.18097,0.18954
385145,ROBISON JEWISH HEALTH CENTER,OR,0.18244,0.18954
056214,RAMONA REHABILITATION AND POST ACUTE CARE CENTER,CA,0.2022,0.18954
365279,MERIT HOUSE LLC,OH,0.19601,0.18955
335658,GROTON COMMUNITY HEALTH CARE CTR RES CARE FAC,NY,0.1826,0.18956
225757,PIONEER VALLEY HEALTH & REHABILITATION,MA,0.22949,0.18956
495293,BERKSHIRE HEALTH & REHABILITATION CENTER,VA,0.1928,0.18956
366461,WOODED GLEN,OH,0.2279,0.18956
675709,TIMBERIDGE NURSING AND REHABILITATION CENTER,TX,0.19645,0.18957
056272,SAN FRANCISCO HEALTH CARE,CA,0.16164,0.18957
235433,GREENFIELD REHAB AND NURSING CENTER,MI,0.22976,0.18958
335723,EAST HAVEN NURSING & REHABILITATION CENTER,NY,0.22438,0.18958
265327,PHELPS HEALTH,MO,0.18823,0.18959
365570,PARK VIEW CARE CENTER,OH,0.212,0.18959
445139,MIDTOWN CENTER FOR HEALTH AND REHABILITATION,TN,0.17995,0.1896
145851,EASTSIDE HEALTH & REHAB CENTER,IL,0.17707,0.18961
315299,KING MANOR CARE AND REHABILITATION CENTER,NJ,0.21751,0.18962
365906,MONARCH MEADOWS NURSING AND REHABILITATION,OH,0.181,0.18962
395343,STONERIDGE TOWNE CENTRE,PA,0.15048,0.18962
495344,KINGS DAUGHTERS COMMUNITY HEALTH & REHAB,VA,0.20418,0.18962
425078,WESLEY COMMONS HEALTH AND REHABILITATION CENTER,SC,0.17771,0.18963
335141,EMERGE NURSING AND REHABILITATION AT GLEN COVE,NY,0.21346,0.18963
525583,RENNES HEALTH AND REHAB CENTER- APPLETON,WI,0.20376,0.18963
175044,BREWSTER HEALTH CENTER,KS,0.1828,0.18964
445292,BEECH TREE HEALTH AND REHABILITATION,TN,0.19416,0.18964
085002,PARKVIEW NURSING,DE,0.19664,0.18964
035158,GOOD SAMARITAN SOCIETY-PRESCOTT VILLAGE,AZ,0.18572,0.18964
335478,ESSEX CENTER FOR REHABILITATION AND HEALTHCARE,NY,0.16158,0.18965
675539,THE BRADFORD AT BROOKSIDE,TX,0.2031,0.18965
455934,NORTHERN OAKS LIVING & REHABILITATION CENTER,TX,0.18767,0.18965
255308,STONE COUNTY REHABILITATION AND NURSING CTR INC,MS,0.21679,0.18965
235706,REGENCY AT LANSING WEST,MI,0.19398,0.18966
335108,SEA VIEW HOSPITAL REHABILITATION CENTER AND HOME,NY,0.20217,0.18966
305030,MAPLE LEAF HEALTH CARE CENTER,NH,0.1848,0.18966
455631,COLONIAL MANOR NURSING CENTER,TX,0.19047,0.18967
455731,ADVANCED HEALTH & REHAB CENTER OF GARLAND,TX,,0.18967
